Id,Label,timeset,stat_inf_class,modularity.class,eigen,modularity_class
https://openalex.org/W2145918162,Legal case-based reasoning as practical reasoning,,14,4,0.00002,0
https://openalex.org/W2146078392,The Rule of Reasons. Three Models of Deliberative Democracy,,18,16,0.000029,9
https://openalex.org/W2146100245,Survey Article: Four Models of a Global Order with Cosmopolitan Intent: An Empirical Assessment,,34,10,0.0001,2
https://openalex.org/W2148721472,"Promising, Intimate Relationships, and Conventionalism",,24,12,0.000412,21
https://openalex.org/W2149012851,A neo-Aristotelian notion of reciprocity: about civic friendship and (the troublesome character of) right judicial decisions,,35,9,0.026068,5
https://openalex.org/W2150816104,Reassessing Luck Egalitarianism,,32,16,0.000012,9
https://openalex.org/W2151161389,Restorative justice The real story,,31,13,0.000007,11
https://openalex.org/W2151540362,The legality of law,,10,7,0.061193,8
https://openalex.org/W2152086554,Measuring the Rule of Law,,8,6,0.000051,12
https://openalex.org/W2152212999,Artificial argument assistants for defeasible argumentation,,14,4,0.000006,0
https://openalex.org/W2152577086,Explaining Away Incompatibilist Intuitions,,5,13,0,11
https://openalex.org/W2152710718,DISCONNECTION AND RESPONSIBILITY,,19,12,0.000016,6
https://openalex.org/W2152723158,Decisions Rules and Conduct Rules: On Acoustic Separation in Criminal Law,,5,13,0.000071,19
https://openalex.org/W2152822720,"Lifestyle, responsibility and justice",,32,16,0.000008,9
https://openalex.org/W2152932702,Rawlsian Reasonableness: A Problematic Presumption?,,24,12,0.000675,21
https://openalex.org/W2153670269,Paradoxes of Constitutional Democracy,,29,11,0.00001,6
https://openalex.org/W2153784802,Taking the Basic Structure Seriously,,28,16,0.002786,9
https://openalex.org/W2153909792,A General Structure for Legal Arguments about Evidence Using Bayesian Networks.,,14,4,0.000001,0
https://openalex.org/W2154473716,Arguing about cases as practical reasoning,,14,4,0.000012,0
https://openalex.org/W2154873883,"Penal subversions: When is a punishment not punishment, who decides and on what grounds?",,2,6,0.000003,7
https://openalex.org/W2155861573,Rights of Exit,,2,16,0.000064,7
https://openalex.org/W2155919539,Hart's critics on defeasible concepts and ascriptivism,,14,4,0.000017,0
https://openalex.org/W2156017621,Facts and Principles,,34,10,0.000104,2
https://openalex.org/W2156156961,DefLog: on the Logical Interpretation of Prima Facie Justified Assumptions,,14,4,0.000009,0
https://openalex.org/W2157218228,Theories of Rights: Is There a Third Way?,,11,16,0.000312,9
https://openalex.org/W2158426478,Harm to Others,,26,16,0.000064,11
https://openalex.org/W2158632923,An Institutional Theory of Law: New Approaches to Legal Positivism,,11,16,0.000629,9
https://openalex.org/W2158899378,Five Minutes of Legal Philosophy (1945),,10,7,0.057128,8
https://openalex.org/W2159444173,The generic/actual argument model of practical reasoning,,14,4,0,0
https://openalex.org/W2160361145,THE RESULT MODEL OF PRECEDENT,,33,4,0.000069,0
https://openalex.org/W2161600894,Rethinking the Offense Principle,,18,3,0.000034,17
https://openalex.org/W2161664509,Dialogues about the burden of proof,,14,4,0.000008,0
https://openalex.org/W2162584304,Penal Communications: Recent Work in the Philosophy of Punishment,,31,13,0.000009,11
https://openalex.org/W2163122097,"Crime, Reason and History: A Critical Introduction to Criminal Law",,16,1,0.00003,10
https://openalex.org/W2163717926,Global Legal Pluralism,,31,6,0.001583,5
https://openalex.org/W2165394735,A Theory of Criminal Justice,,5,13,0.000008,19
https://openalex.org/W2165507089,Democracy and noncitizen voting rights,,22,11,0.000007,6
https://openalex.org/W2165829448,THE BASIS OF MORAL LIABILITY TO DEFENSIVE KILLING,,24,14,0.000011,1
https://openalex.org/W2166115596,Legal Reasoning and Legal Theory,,33,6,0.002658,12
https://openalex.org/W2166129803,"Autonomy, Vulnerability, Recognition, and Justice",,29,11,0.000025,6
https://openalex.org/W2166258569,On the Optimal Mix of Private and Common Property,,29,11,0.000001,7
https://openalex.org/W2166440622,Why democracy must be global: self-founding and democratic intervention,,22,11,0.000021,2
https://openalex.org/W2167415912,Sovereignty and International Order,,33,6,0.00004,12
https://openalex.org/W2167530255,Why do states have territorial rights,,31,5,0.000026,2
https://openalex.org/W2167543484,A formalization of argumentation schemes for legal case-based reasoning in ASPIC+,,14,4,0.000014,0
https://openalex.org/W2167596655,War and Self-Defense,,24,14,0.000029,1
https://openalex.org/W2168567553,Economic development as opportunity equalization,,32,16,0.000003,9
https://openalex.org/W2168724035,The Subjects of Collectively Binding Decisions: Democratic Inclusion and Extraterritorial Law,,22,11,0.000004,2
https://openalex.org/W2168812553,Using values and theories to resolve disagreement in law 1,,14,4,0.000036,0
https://openalex.org/W2169609299,Relating Protocols For Dynamic Dispute With Logics For Defeasible Argumentation,,14,4,0.000006,0
https://openalex.org/W2169899696,The Legitimacy of Global Governance Institutions,,31,16,0.000449,2
https://openalex.org/W2170244904,RULES AND REASONS IN THE THEORY OF PRECEDENT,,33,4,0.000115,0
https://openalex.org/W2171210171,Jurisprudential Regimes in Supreme Court Decision Making,,2,6,0.000027,5
https://openalex.org/W2171845630,The Idea of a European Constitution,,34,10,0.000118,2
https://openalex.org/W2172081173,Contract Remedies and Inalienable Rights,,2,16,0.000059,7
https://openalex.org/W2172290391,Defining the demos,,22,11,0.000006,2
https://openalex.org/W2175432277,Foucault and Law: Towards a Sociology of Law As Governance,,31,11,0.000032,12
https://openalex.org/W2183815754,Distribution of responsibilities in international law,,5,14,0.000174,1
https://openalex.org/W2199863608,"Property, Justification and Need",,31,11,0.0001,9
https://openalex.org/W2208105206,Equal Opportunity and Gender Disadvantage,,32,16,0.000045,7
https://openalex.org/W2208593751,Legal reasoning and practical political education,,29,1,0.000002,6
https://openalex.org/W2209158330,Coherence in Legal Justification,,33,6,0.003728,0
https://openalex.org/W2210378618,Legal Positivism: 5½ Myths,,9,15,0.26725,12
https://openalex.org/W2223128576,Theoretical Underpinning of Intellectual Property: “I am a Pragmatist But Theory is my Rhetoric”,,25,6,0.000052,12
https://openalex.org/W2224287703,"Manipulation Arguments, Basic Desert, and Moral Responsibility: Assessing Derk Pereboom’s Free Will, Agency, and Meaning in Life",,5,13,0,11
https://openalex.org/W222564579,The Charter Dialogue between Courts and Legislatures (Or Perhaps the Charter of Rights Isn't Such a Bad Thing after All),,35,9,0.007664,5
https://openalex.org/W2226373706,The Concept of Law Revisited,,9,6,0.005489,12
https://openalex.org/W2230213725,"Self-Ownership and Equality: Brute Luck, Gifts, Universal Dominance, and Leximin",,32,16,0.000234,9
https://openalex.org/W2234243791,Ronald Dworkin Replies,,32,16,0.000024,9
https://openalex.org/W2234743905,Customary law as a social contract: International commercial law,,33,6,0.000043,12
https://openalex.org/W2238529471,Reasoning with Rules,,14,4,0.000241,0
https://openalex.org/W2239126805,Law as Institutional Fact,,20,7,0.000289,12
https://openalex.org/W2245781267,The Common good,,34,10,0.00003,2
https://openalex.org/W2262659060,The Practice of Principle,,25,6,0.008273,12
https://openalex.org/W2269015068,"Procedural Justice, Legitimacy, and the Effective Rule of Law",,10,7,0.011748,8
https://openalex.org/W2270772451,Freedom and Resentment,,5,13,0.000095,11
https://openalex.org/W2272983765,Between authority and interpretation,,25,6,0.009976,12
https://openalex.org/W2274821182,Two Unhappy Dilemmas for Natural Law Jurisprudence,,27,15,0.84777,20
https://openalex.org/W2281690980,"Law, Morality, and the Existence of Human Rights*",,27,15,0.464236,20
https://openalex.org/W2284105538,Jurisprudence and Necessity,,27,15,0.698564,20
https://openalex.org/W2293099500,OASIS LegalRuleML,,24,4,0.000001,0
https://openalex.org/W2299562192,A Theory of Freedom of Expression,,16,3,0.000023,17
https://openalex.org/W2300145471,Autonomy as a Perfection,,29,11,0.000004,6
https://openalex.org/W2306435137,Positivism and Conventionalism,,25,6,0.002324,12
https://openalex.org/W2311923057,A plea for excuses,,5,13,0.000914,19
https://openalex.org/W2312450878,Moral Responsibility and “Moral Luck”,,5,13,0,11
https://openalex.org/W2313820734,Group Membership and Political Obligation,,0,8,0.000741,9
https://openalex.org/W2314721085,The Many Faces of Legal Positivism,,9,6,0.000312,12
https://openalex.org/W2314904110,The Morality of Law.,,8,6,0.004343,12
https://openalex.org/W2315240269,Offense to Others: The Moral Limits of the Criminal Law,,26,16,0.000011,11
https://openalex.org/W2316197745,Responsibility and the Moral Sentiments,,5,13,0.000036,11
https://openalex.org/W2316915260,"Self-Ownership, Freedom and Equality",,37,16,0.013466,9
https://openalex.org/W2317549675,Essays on Bentham: Jurisprudence and Political Theory,,26,6,0.000989,12
https://openalex.org/W2319293491,"Intention, agency, and criminal liability",,5,13,0.000009,11
https://openalex.org/W2319840190,Harm to Self: The Moral Limits of the Criminal Law,,26,16,0.000019,11
https://openalex.org/W2320528271,Justice as Fairness,,6,16,0.000147,9
https://openalex.org/W2320881999,The pure theory of law,,24,6,0.000967,12
https://openalex.org/W2321644869,Force and freedom,,22,0,0.000149,9
https://openalex.org/W2322510918,"The First Principle of Practical Reason: A Commentary on the Summa theologiae , 1–2, Question 94, Article 2",,10,7,0.000599,8
https://openalex.org/W2324467282,"Reification in and through law: Elements of a theory in Marx, Lukács, and Honneth:",,29,11,0.000008,6
https://openalex.org/W2326194808,A methodology for designing systems to reason with legal cases using Abstract Dialectical Frameworks,,14,4,0.000006,0
https://openalex.org/W2326201171,Theoretical Foundations of Liberalism,,29,11,0.000182,6
https://openalex.org/W2326580376,Are There Any Natural Rights,,21,16,0.102255,9
https://openalex.org/W2327095970,The Economy of the Earth,,26,16,0.000008,9
https://openalex.org/W2330528382,The Toxin Puzzle,,5,11,0.000023,11
https://openalex.org/W2330814089,"Rights, Boundaries, and the Bonds of Community: A Qualified Defense of Moral Parochialism",,6,16,0.000068,9
https://openalex.org/W2331320796,"The ""Positivism"" of Marsiglio of Padua",,10,2,0.000246,23
https://openalex.org/W2333564218,Two concepts of rules,,19,12,0.00167,11
https://openalex.org/W2335502651,Theorie der juristischen Argumentation,,33,4,0.000138,0
https://openalex.org/W2336615460,Interpretation of the Prohibition of Torture: Making Sense of ‘Dignity’ Talk,,16,1,0.000015,10
https://openalex.org/W2336640018,On the nature of argument schemes,,14,4,0.000001,0
https://openalex.org/W2338448258,"Hard-Incompatibilist Existentialism: Neuroscience, Punishment, and Meaning in Life",,5,13,0.000004,11
https://openalex.org/W2342553802,I.—A Plea for Excuses: The Presidential Address,,22,13,0.000055,19
https://openalex.org/W2343130259,State Consent and Disagreement in International Law-Making. Dissolving the Paradox,,35,9,0.018435,5
https://openalex.org/W2345356232,Corrective Justice and Correlativity in Private Law,,2,16,0.000071,7
https://openalex.org/W239583631,American Legal Realism,,2,6,0.000095,7
https://openalex.org/W2396038514,Relating Values in a Series of Supreme Court Decisions.,,14,4,0.00001,0
https://openalex.org/W2397389185,"The Forces of Law: Duty, Coercion, and Power",,27,15,0.669829,20
https://openalex.org/W2398341336,Two Models of Pluralism and Tolerance,,26,16,0.00011,11
https://openalex.org/W2406050175,Argumentation schemes for reasoning about factors with dimensions,,14,4,0.000008,0
https://openalex.org/W2411382158,"Law's Ethical, Global and Theoretical Contexts: Essays in Honour of William Twining",,16,1,0.004119,10
https://openalex.org/W24321227,The harm principle,,26,16,0.000013,11
https://openalex.org/W2464795789,"A European Republic of Sovereign States: Sovereignty, republicanism and the European Union:",,34,10,0.000005,2
https://openalex.org/W2465252952,Subsidiarity in International Human Rights Law—What is Subsidiary about Human Rights?,,35,9,0.01878,5
https://openalex.org/W2465660541,"Associative obligations, voluntarism, and equality",,0,8,0.000711,9
https://openalex.org/W2469236851,The Global Turn in Legal Theory,,35,9,0.024173,5
https://openalex.org/W2472268654,A DEVOTIONAL THEORY OF LAW: EPISTEMOLOGY AND MORAL PURPOSE IN EARLY ISLAMIC JURISPRUDENCE,,4,6,0.000168,12
https://openalex.org/W2473849596,"Three Models of Republican Rights: Juridical, Parliamentary and Populist:",,34,10,0.000006,2
https://openalex.org/W2475342199,International Courts and Tribunals and Their Linguistic Practices: A Communities of Practice Approach,,35,9,0.026068,5
https://openalex.org/W2476417175,6. Should Communities Have Rights? Reflections on Liberal Individualism,,0,8,0.000345,9
https://openalex.org/W2478327607,Normative (or Ethical) Positivism,,9,6,0.006383,12
https://openalex.org/W2479324209,Justice Beyond Borders,,34,5,0.000152,2
https://openalex.org/W2479717040,The Law of Construction Privileges: Corrective Justice or Distributive Justice?,,2,16,0.000095,7
https://openalex.org/W2479792795,The Opposite Mirrors,,20,7,0.000258,12
https://openalex.org/W2479920742,Justice as Fairness: Political Not Metaphysical,,19,11,0.000155,6
https://openalex.org/W2482190191,"Calvinism and resistance theory, 1550–1580",,20,16,0.000066,9
https://openalex.org/W2482650273,Territorial Justice and Global Redistribution,,28,5,0.000124,2
https://openalex.org/W2482790115,On the nature of law,,25,6,0.013301,12
https://openalex.org/W2483381315,"Justice, legitimacy, and self-determination",,13,16,0.000514,2
https://openalex.org/W2483607234,Prolegomenon to the Principles of Punishment,,5,13,0.000022,11
https://openalex.org/W2484743188,Authority for Officials,,27,15,0.590929,20
https://openalex.org/W2484768313,The Hypothesis of the Basic Norm: Hans Kelsen and Hermann Cohen*,,22,0,0.000004,4
https://openalex.org/W2485007749,Hans Kelsen's Pure Theory of Law,,27,6,0.000082,12
https://openalex.org/W2485474302,Legality's Borders,,35,15,0.437329,20
https://openalex.org/W2486551014,Not Just Deserts,,5,13,0.000003,11
https://openalex.org/W2487352873,Contract as promise,,2,12,0.000163,7
https://openalex.org/W2489309582,A Virtue-Centered Account of Equity and the Rule of Law,,35,9,0.025388,5
https://openalex.org/W2493478147,The right to threaten and the right to punish,,5,13,0.000008,11
https://openalex.org/W2494253397,Hart and the Principles of Legality,,27,15,0.747329,20
https://openalex.org/W2494532817,"Legal Theory, Legal Interpretation, and Judicial Review",,7,6,0.013149,8
https://openalex.org/W2494846613,Scanlon on Promising,,24,12,0.000611,21
https://openalex.org/W2494870707,Commitment in dialogue,,14,4,0.000008,0
https://openalex.org/W2495620656,The Rule of Law and its Virtue,,8,6,0.000567,12
https://openalex.org/W2495995249,Does global legal pluralism need a concept of law,,35,9,0.02421,5
https://openalex.org/W2496320657,Is democratic legitimacy possible for international institutions,,34,10,0.000171,2
https://openalex.org/W2496515953,Democracy and Distrust: A Theory of Judicial Review,,4,6,0.00048,5
https://openalex.org/W2497552771,"Punishment, Feminism, and Political Identity: A Case Study in the Expressive Meaning of the Law",,31,13,0.000001,11
https://openalex.org/W2499024739,Special ties and natural duties,,28,16,0.009206,9
https://openalex.org/W2499586832,Interpretive Construction in the Substantive Criminal Law,,2,6,0.000038,7
https://openalex.org/W2499860198,Terrorism and the Right to Resist: A Theory of Just Revolutionary War,,34,5,0.000014,2
https://openalex.org/W2499875828,Playing by the Rules,,30,6,0.000679,12
https://openalex.org/W2500461989,The Moral Limits of the Criminal Law Volume 1: Harm to Others,,26,16,0.00008,11
https://openalex.org/W2500462578,In Defense of Legal Positivism,,30,6,0.000592,12
https://openalex.org/W2501830078,"Free Will Skepticism, Blame, and Obligation",,5,13,0.000001,11
https://openalex.org/W2502699649,Sovereignty and the mixed constitution: Bodin and his critics,,20,16,0.000005,9
https://openalex.org/W2505082533,Immanuel Kant: Practical philosophy: Index of subjects,,18,16,0.000071,9
https://openalex.org/W2505197150,The reception of Hobbes,,20,16,0.000042,9
https://openalex.org/W2505959087,Liberty and Morality,,26,16,0.000039,11
https://openalex.org/W2506048056,The Moral Limits of the Criminal Law: Volume 2: Offense to Others,,26,6,0.000045,11
https://openalex.org/W2506502828,Definition and Theory in Jurisprudence,,2,6,0.000162,12
https://openalex.org/W2508633680,Do the guilty deserve punishment,,5,13,0.000137,11
https://openalex.org/W2509878344,Natural Law Theories,,10,7,0.065144,8
https://openalex.org/W2517998746,"Enfranchising all subjected, worldwide",,22,11,0.000004,2
https://openalex.org/W2518180052,The Duty to Disobey Immigration Law,,31,5,0.000021,2
https://openalex.org/W2521193318,Blameworthiness as Deserved Guilt,,5,13,0,11
https://openalex.org/W2524592306,Answering for Crime,,5,13,0.000021,11
https://openalex.org/W2525384493,"Critical Notice of G.A. Cohen’s Self-Ownership, Freedom, and Equality",,32,16,0.000322,9
https://openalex.org/W2535037698,An essay on rights,,11,16,0.000583,9
https://openalex.org/W2547343163,Field Research on Law in Conflict Zones and Authoritarian States,,8,14,0,7
https://openalex.org/W2548845514,Inter-Philosophies Dialogue: Creating a Paradigm for Global Health Ethics,,28,5,0.000107,2
https://openalex.org/W2556643168,XI.—The Ascription of Responsibility and Rights,,14,4,0.000609,0
https://openalex.org/W2566060439,On Civil Disobedience,,30,6,0.000102,9
https://openalex.org/W2573840980,A Pragma-Dialectical Approach of the Analysis and Evaluation of Pragmatic Argumentation in a Legal Context,,33,6,0.000016,5
https://openalex.org/W2583317101,Building the Constitution: The Practice of Constitutional Interpretation in Post-Apartheid South Africa,,2,6,0.000002,7
https://openalex.org/W2583925548,"A Defense of Free Will Skepticism: Replies to Commentaries by Victor Tadros, Saul Smilansky, Michael McKenna, and Alfred R. Mele on Free Will, Agency, and Meaning in Life",,5,13,0.000003,11
https://openalex.org/W2586157681,The (True) Nature of a Beneficiary’s Equitable Proprietary Interest under a Trust,,11,16,0.000005,9
https://openalex.org/W2586509828,Decision Support for Practical Reasoning: a theoretical and computational perspective,,14,4,0.000002,0
https://openalex.org/W2586887456,“A New Philosophy for International Law” and Dworkin’s Political Realism,,27,15,0.959612,20
https://openalex.org/W2600325764,Crime and Culpability: The Culpable Act,,5,13,0.000002,11
https://openalex.org/W2601198735,Responsibility and Fault,,2,6,0.000037,7
https://openalex.org/W2604157157,What the Old Law Reveals About the Natural Law According to Thomas Aquinas,,10,2,0.001288,23
https://openalex.org/W2605656310,A unified account of the moral standing to blame,,5,13,0,11
https://openalex.org/W2609779437,Ronald Dworkin: The “Hart–Dworkin” Debate: A Short Guide for the Perplexed,,16,6,0.004785,12
https://openalex.org/W2611478877,BEYOND EQUAL LIBERTY: RELIGION AS A DISTINCT HUMAN GOOD AND THE IMPLICATIONS FOR RELIGIOUS FREEDOM,,10,7,0.001774,8
https://openalex.org/W2620701673,HYPO’S legacy: introduction to the virtual special issue,,14,4,0.000009,0
https://openalex.org/W2621059063,"Legal positivism, conventionalism, and the normativity of law",,27,15,0.845056,20
https://openalex.org/W26655238,Combining case-based and rule-based reasoning: a heuristic approach,,14,4,0.000019,0
https://openalex.org/W2678900356,About the logical relations between cases and rules,,14,4,0.000017,0
https://openalex.org/W2734673746,The Concept and the Rule of Law,,8,6,0.001172,12
https://openalex.org/W2756093232,"Settlement, expulsion, and return:",,28,5,0.00006,2
https://openalex.org/W2765247058,Can There Be an Artifact Theory of Law,,27,15,0.730646,20
https://openalex.org/W2765743562,When does evidence suffice for conviction,,22,13,0,3
https://openalex.org/W2766777273,Representing dimensions within the reason model of precedent,,14,4,0.00001,0
https://openalex.org/W2767204706,Justice as a claim to (social) property,,29,11,0.000004,6
https://openalex.org/W2767735812,The Historic Background of Corporate Legal Personality,,5,13,0.000011,18
https://openalex.org/W2767748633,"Response-Dependent Responsibility; or, A Funny Thing Happened on the Way to Blame",,5,13,0,11
https://openalex.org/W2768087180,"Truth, Knowledge, and the Standard of Proof in Criminal Law",,22,13,0,3
https://openalex.org/W2774896322,The problem of punishment,,5,13,0.000071,11
https://openalex.org/W2789362769,Justice without Retribution: An Epistemic Argument against Retributive Criminal Punishment,,5,13,0.000001,11
https://openalex.org/W2795539502,Fundamental Legal Conceptions,,11,16,0.000392,9
https://openalex.org/W2795587260,Positivism and Fidelity to Law: A Reply to Professor Hart,,4,6,0.010422,12
https://openalex.org/W2795655825,Legal Theory and the Obligation of a Judge: The Hart/Dworkin Dispute,,9,6,0.002941,12
https://openalex.org/W2795709295,Public Response to Racist Speech: Considering the Victim’s Story,,18,3,0.00002,17
https://openalex.org/W2795724202,"The Supreme Court, 1982 Term",,35,9,0.006468,5
https://openalex.org/W2795733956,Legal Formalism: On the Immanent Rationality of Law,,2,6,0.001058,7
https://openalex.org/W2795796782,The Perplexing Borders of Justification and Excuse,,5,13,0.000039,19
https://openalex.org/W2795915211,Legal Principles and the Limits of Law,,24,12,0.001527,19
https://openalex.org/W2796019385,The Right and the Reasonable,,24,12,0.000374,21
https://openalex.org/W2796173346,Constitutional Law in the Age of Balancing,,33,6,0.00016,5
https://openalex.org/W2796328480,The Empty Idea of Equality,,23,6,0.000067,12
https://openalex.org/W2796415624,Political Authority and Political Obligation,,0,8,0.001059,9
https://openalex.org/W2796476225,"Principles, Positivism, and Legal Theory",,9,6,0.002996,12
https://openalex.org/W2796528567,Kantian Constructivism in Moral Theory,,19,12,0.000136,6
https://openalex.org/W2796554849,Law's Republic,,29,1,0.000053,6
https://openalex.org/W2796592586,The Path of the Law,,30,6,0.002482,7
https://openalex.org/W2797131397,Is There a Prima Facie Obligation to Obey the Law,,10,7,0.036565,8
https://openalex.org/W2797180162,A Realistic Jurisprudence: The Next Step,,2,6,0.000116,7
https://openalex.org/W2797213284,The Forms and Limits of Adjudication,,2,6,0.000352,7
https://openalex.org/W2797227964,Kant: The Metaphysical Elements of Justice,,20,16,0.000161,9
https://openalex.org/W2797339575,Transcendental Nonsense and the Functional Approach,,2,6,0.000284,7
https://openalex.org/W2797353397,Political Liberalism: Reply to Habermas,,19,16,0.00001,9
https://openalex.org/W2797387575,Fairness and Utility in Tort Theory,,2,16,0.000073,19
https://openalex.org/W2797422441,Validity and Legal Conflicts,,9,6,0.000152,12
https://openalex.org/W2797629819,Promises in Morality and Law,,24,12,0.000505,21
https://openalex.org/W2797638389,Form and Substance in Private Law Adjudication,,30,6,0.000152,7
https://openalex.org/W2797647637,Doing and Deserving,,5,13,0.000153,11
https://openalex.org/W2797910919,The Reliance Interest in Property,,2,16,0.000042,7
https://openalex.org/W2797922323,Authority and Consent,,24,12,0.00169,21
https://openalex.org/W2798329923,Ethics in the Public Domain,,25,6,0.004659,12
https://openalex.org/W2801226138,Some Realism about Realism— Responding to Dean Pound,,2,6,0.000142,7
https://openalex.org/W2801790053,Two Treatises of Government.,,20,16,0.000149,7
https://openalex.org/W2801922534,On The Pure Theory of Law,,27,15,0.54936,20
https://openalex.org/W2802748901,Liability and Individualized Evidence,,22,13,0.000001,3
https://openalex.org/W2802756270,How to Do Things with Rules,,33,4,0.000087,12
https://openalex.org/W2804485250,The rational impermissibility of accepting (some) racial generalizations,,22,13,0,3
https://openalex.org/W2806942279,Debating the Imperative Mood in Uṣūl al-Fiqh: Collective Deliberation and Legal Validity,,4,6,0.000161,12
https://openalex.org/W2889796974,The Player and the Cards: Nihilism and Legal Theory,,31,6,0.000061,7
https://openalex.org/W2891971646,Trial by Statistics: Is a High Probability of Guilt Enough to Convict?,,22,13,0,3
https://openalex.org/W2894596653,The Bramble Bush,,2,6,0.000052,7
https://openalex.org/W2899341281,The Difficulty of Tolerance by T. M. Scanlon,,28,16,0.002475,9
https://openalex.org/W2899766258,Responsibility and control,,5,13,0.000004,11
https://openalex.org/W2902169720,MORAL ACCOUNTABILITY AND SOCIAL NORMS,,29,11,0.000003,6
https://openalex.org/W2908356886,"Authority, Law, and Razian Reasons",,25,6,0.006096,12
https://openalex.org/W2914176469,Abstract argumentation,,14,4,0.000014,0
https://openalex.org/W2931661505,Facing Up: A Reply,,35,9,0.011287,12
https://openalex.org/W2943869298,Hegel: Elements of the Philosophy of Right,,29,11,0.000047,6
https://openalex.org/W2946328468,Inter-Legality and the Protection of the Marine Ecosystems,,5,14,0.000011,1
https://openalex.org/W2949187669,Grotius on Natural Law and Supererogation,,10,2,0.001334,23
https://openalex.org/W2963156343,Emotive Language in Argumentation: Contents,,14,4,0.000001,0
https://openalex.org/W2966640954,The Structure of Blackstone's Commentaries,,23,6,0.0001,12
