Id,Label,timeset,stat_inf_class,modularity.class,eigen,modularity_class
https://openalex.org/W1022946631,Democracy and Distrust,,30,6,0.000122,5
https://openalex.org/W103431794,International Law and Morality in the Theory of Secession,,0,8,0.000439,9
https://openalex.org/W104357497,"Exemplary Reasoning: Semantics, Pragmatics, and the Rational Force of Legal Argument by Analogy",,33,4,0.000151,0
https://openalex.org/W104378995,"The Supreme Court, 1982 Term -- Foreword: Nomos and Narrative",,2,9,0.000144,5
https://openalex.org/W105723337,Thirty Years On,,25,6,0.006381,12
https://openalex.org/W106159907,Political Obligation: A Critical Introduction,,21,16,0.000412,9
https://openalex.org/W107842537,Liberalism without Perfection,,19,16,0.000213,9
https://openalex.org/W109677913,The Core of the Case Against Judicial Review,,4,9,0.006239,5
https://openalex.org/W1104365280,"Eliminative Materialism, Neuroscience and the Criminal Law",,2,6,0.000009,7
https://openalex.org/W1152817606,Self-expression: a deep self theory of moral responsibility,,5,13,0.000001,11
https://openalex.org/W1172060961,The Sandelian Republic and the Encumbered Self,,18,16,0.00004,9
https://openalex.org/W127338104,The Collapse of the Harm Principle,,26,16,0.000018,11
https://openalex.org/W127361949,Violence and the Word,,2,6,0.00011,7
https://openalex.org/W129283682,Modelling Reasoning with Precedents in a Formal Dialogue Game,,14,4,0.000091,0
https://openalex.org/W135169145,Artificial Intelligence and Law: Stepping Stones to a Model of Legal Reasoning,,14,4,0.00005,0
https://openalex.org/W136591480,Kant's Legal Positivism,,22,6,0.002378,12
https://openalex.org/W138458895,The Case of the Speluncean Explorers,,4,6,0.000091,12
https://openalex.org/W143717986,Private law as an open legal order: understanding contract and tort as interactional law,,35,9,0.025388,5
https://openalex.org/W1450459739,Some Confusions Concerning Collective Rights,,0,8,0.00038,9
https://openalex.org/W145388696,What is Equality? Part 1: Equality of Welfare,,32,16,0.000106,9
https://openalex.org/W1469406,The Idea of Public Reason Revisited,,19,16,0.000121,9
https://openalex.org/W1480951599,Jumps and logic in the law,,14,4,0.000069,0
https://openalex.org/W1482768500,The Role of Logic in Computational Models of Legal Argument: A Critical Survey,,14,4,0.000007,0
https://openalex.org/W1483374326,Sovereign Virtue: The Theory and Practice of Equality,,18,16,0.000239,9
https://openalex.org/W1484347295,"Jaap Hage, Reasoning with Rules: An Essay on Legal Reasoning and Its Underlying Logic. Law and Philosophy Library",,14,4,0.000012,0
https://openalex.org/W1484722677,Argumentation Machines: New Frontiers in Argument and Computation,,14,4,0.000003,0
https://openalex.org/W1485501857,Pure Theory of Law,,20,6,0.005652,12
https://openalex.org/W1485844409,Where Law and Morality Meet,,9,6,0.003894,12
https://openalex.org/W1485874378,The Idea of Private Law,,2,16,0.001181,7
https://openalex.org/W1486267044,"The role of context in case-based legal reasoning: teleological, temporal, and procedural",,14,4,0.000018,0
https://openalex.org/W1487323630,"Justice, Gender, and the Politics of Multiculturalism",,22,11,0.000002,6
https://openalex.org/W1487379640,A constructive framework for legal ontologies,,24,4,0.000019,13
https://openalex.org/W1488505771,The New Rhetoric: A Treatise on Argumentation,,14,4,0.000034,0
https://openalex.org/W1489372415,Punishment and responsibility,,5,13,0.00013,11
https://openalex.org/W1490967561,Contract Law and Distributive Justice,,2,16,0.000067,7
https://openalex.org/W1491223880,The Tempting of America: The Political Seduction of the Law,,4,6,0.000062,5
https://openalex.org/W1491401198,The Works of Jeremy Bentham,,33,6,0.000146,12
https://openalex.org/W1492279571,Forgiveness and Mercy,,5,13,0.000027,11
https://openalex.org/W1493648651,The Rule of State Law Versus the Rule-of-Law State: Economic Analysis of the Legal Foundations of Development,,23,6,0.000061,12
https://openalex.org/W1494817860,"A theory of political obligation : membership, commitment, and the bonds of society",,29,16,0.000147,9
https://openalex.org/W1495037185,"Indigenous rights and United Nations standards : self-determination, culture and land",,16,1,0.000008,10
https://openalex.org/W1495102811,A history of the criminal law of England,,5,13,0.00001,19
https://openalex.org/W1497100241,"Fairness, responsibility, and welfare",,32,16,0.000023,9
https://openalex.org/W1497647472,"Punishment, Communication, and Community",,5,13,0.000163,11
https://openalex.org/W1498667339,Dynamic statutory interpretation,,30,6,0.00007,5
https://openalex.org/W1498731399,Is Democracy Possible Here?: Principles for a New Political Debate,,4,6,0.000486,5
https://openalex.org/W1499476502,Constitutional Justice: A Liberal Theory of the Rule of Law,,8,6,0.000781,12
https://openalex.org/W1500187011,Harsh Justice: Criminal Punishment and the Widening Divide Between America and Europe,,27,13,0.000003,11
https://openalex.org/W1501756943,Expert Systems in Law,,14,4,0.000028,0
https://openalex.org/W1501768235,Natural law in jurisprudence and politics,,10,7,0.003177,12
https://openalex.org/W1503479491,Overcriminalization: The Limits of the Criminal Law,,5,13,0.000014,11
https://openalex.org/W1504060166,The Common Law,,2,6,0.000274,7
https://openalex.org/W1504175823,An introduction to law and legal reasoning,,33,4,0.000092,0
https://openalex.org/W1504344787,Classical legal positivism in international law revisited,,27,15,0.844251,20
https://openalex.org/W1504374584,Can There be a Theory of Law,,7,15,0.01198,12
https://openalex.org/W1504699294,Causation and the Excuses,,5,13,0.000004,19
https://openalex.org/W1507034046,Law as a Social System,,31,6,0.000195,12
https://openalex.org/W1507985951,The Model of Rules,,33,6,0.001546,12
https://openalex.org/W1508183662,Naturrecht und materiale Gerechtigkeit,,20,16,0.000001,9
https://openalex.org/W1508429220,Responsibility in law and morality,,26,6,0.000029,11
https://openalex.org/W1508831339,"Moral Dimensions: Permissibility, Meaning, Blame",,24,13,0.000059,11
https://openalex.org/W1509866152,Natural law and the theory of property : Grotius to Hume,,20,16,0.000017,23
https://openalex.org/W1510947511,"Justice, Legitimacy, and Self-Determination: Moral Foundations for International Law",,13,16,0.000615,2
https://openalex.org/W1511258558,The Problems of Jurisprudence,,30,6,0.000258,7
https://openalex.org/W1511264461,"The Second-Person Standpoint: Morality, Respect, and Accountability",,5,13,0.000179,11
https://openalex.org/W1512637848,The nature of the common law,,33,4,0.000114,0
https://openalex.org/W1514075784,In Defense of Anarchism,,21,16,0.000417,9
https://openalex.org/W1514428340,Faces of Intention: Selected Essays on Intention and Agency,,29,11,0.000263,6
https://openalex.org/W1514637386,Logical Tools for Modelling Legal Argument,,14,4,0.000098,0
https://openalex.org/W1514715482,The Citizen and the Alien: Dilemmas of Contemporary Membership,,22,11,0.000003,6
https://openalex.org/W1515891061,Natural Law Theory,,7,6,0.000264,12
https://openalex.org/W1516740357,Justice as translation : an essay in cultural and legal criticism,,2,6,0.00003,7
https://openalex.org/W1517612892,System des heutigen römischen Rechts,,2,11,0.000041,2
https://openalex.org/W1518206697,Semiotics and Legal Theory,,33,6,0.000076,7
https://openalex.org/W1518249528,The Pleadings Game: An Artificial Intelligence Model of Procedural Justice,,14,4,0.000055,0
https://openalex.org/W1518929111,The Oxford handbook of jurisprudence and philosophy of law,,35,6,0.006522,12
https://openalex.org/W1519482041,Freedom and the Law,,8,6,0.000045,12
https://openalex.org/W1519668286,The Expressive Conception of Norms,,20,6,0.000485,13
https://openalex.org/W1520061437,Crime and punishment in ancient Rome,,33,6,0.000075,12
https://openalex.org/W1520198837,Ruling the World?: The Cosmopolitan Turn in Constitutionalism: On the Relationship between Constitutionalism in and beyond the State,,34,10,0.000765,2
https://openalex.org/W1521433304,Credulous and Sceptical Argument Games for Preferred Semantics,,14,4,0.000006,0
https://openalex.org/W1522331304,Religion and the obligations of citizenship,,19,16,0.000019,9
https://openalex.org/W1522342316,A Theory of Constitutional Rights,,33,6,0.001371,5
https://openalex.org/W1523838136,Bentham and the Common Law Tradition,,33,6,0.002636,12
https://openalex.org/W1524164055,Teaching case-based argumentation through a model and examples,,14,4,0.000074,0
https://openalex.org/W1525480575,Killing in War,,24,14,0.000045,1
https://openalex.org/W1527018558,The Practice of Principle: In Defence of a Pragmatist Approach to Legal Theory,,9,6,0.006911,12
https://openalex.org/W1527525914,Argument in Artificial Intelligence and Law,,14,4,0.000011,0
https://openalex.org/W1527529729,12. The Difficulty of Tolerance,,26,16,0.000119,11
https://openalex.org/W1528305927,"Group Agency: The Possibility, Design, and Status of Corporate Agents",,29,16,0.00009,18
https://openalex.org/W1528529777,A Matter of Interpretation: Federal Courts and the Law,,30,6,0.000171,5
https://openalex.org/W1528832188,Textbook of criminal law,,5,13,0.000009,19
https://openalex.org/W1529277309,Essays in jurisprudence and philosophy,,25,6,0.00618,12
https://openalex.org/W1531766078,A comment on the Commentaries and A fragment on government,,33,6,0.000786,12
https://openalex.org/W1531887372,"Douglas Walton, The New Dialectic. Conversational Contexts of Argument. Toronto: University of Toronto Press (Book Review)",,14,4,0.000001,0
https://openalex.org/W1533067089,The Blackwell Guide to the Philosophy of Law and Legal Theory,,35,6,0.002079,12
https://openalex.org/W1533531500,Liability to Defensive Harm,,24,14,0.000012,1
https://openalex.org/W1534854312,American constitutional law,,4,6,0.000051,5
https://openalex.org/W1536162307,The argument from injustice : a reply to legal positivism,,10,6,0.008473,12
https://openalex.org/W1537046490,The limits of morality,,11,16,0.000285,9
https://openalex.org/W1537848071,Legal knowledge engineering : a modelling approach,,24,4,0.000039,13
https://openalex.org/W1537940627,"Quid juris? Quid facti?: D’une nouvelle tentative de relever une opposition capitale: Jean-Renaud Seba, Le partage de l’empirique et du transcendantal. Essai sur la normativité de la raison: Kant, Hegel, Husserl. Bruxelles, Éditions Ousia, 2006, 440 pp., 24 Euros, ISBN 978-2-87060-126-6",,22,0,0.000004,4
https://openalex.org/W1539153592,The Idea of Human Rights,,16,16,0.000635,2
https://openalex.org/W1539274691,Freedom's Law: The Moral Reading of the American Constitution,,4,6,0.000885,5
https://openalex.org/W1539331218,"Domination and Global Political Justice: Conceptual, Historical and Institutional Perspectives",,34,10,0.000005,2
https://openalex.org/W1539774528,The constitution of equality,,36,16,0.000371,9
https://openalex.org/W1540639531,Rethinking Legal Realism: Toward a Naturalized Jurisprudence,,2,6,0.002312,7
https://openalex.org/W1541077798,Rawls's Political Liberalism. A Reassessment,,10,1,0.000202,10
https://openalex.org/W1541703906,Living without free will,,5,13,0.000009,11
https://openalex.org/W1541980668,Jurisprudence: Theory and Context,,30,6,0.001124,12
https://openalex.org/W1542071146,"Questioning Sovereignty: Law, State, and Nation in the European Commonwealth",,22,9,0.000105,5
https://openalex.org/W1543073428,Ours is a broad church: indirectly evaluative legal philosophy as a facet of jurisprudential inquiry,,27,15,0.843063,20
https://openalex.org/W1543091713,"Liberal Loyalty: Freedom, Obligation, and the State",,22,16,0.000071,9
https://openalex.org/W1544387588,Autonomy and the Challenges to Liberalism: Political Liberty: Integrating Five Conceptions of Autonomy,,29,11,0.000007,6
https://openalex.org/W1544949079,The dignity of legislation,,18,16,0.000248,9
https://openalex.org/W1547717991,Vagueness in Law and Language: Some Philosophical Issues,,7,6,0.000092,12
https://openalex.org/W1547766285,Lloyd's Introduction to Jurisprudence,,7,6,0.00014,12
https://openalex.org/W1547775889,Democratic Equality and Political Authority,,22,11,0.000071,9
https://openalex.org/W1548327129,An analysis of rights,,11,16,0.000375,9
https://openalex.org/W1548654059,Censure and sanctions,,5,13,0.000043,11
https://openalex.org/W1550009688,Globalisation and legal theory,,25,6,0.001791,12
https://openalex.org/W1553120579,The spirit of the laws,,20,16,0.00009,9
https://openalex.org/W1553362627,Institutions of Law: An Essay in Legal Theory,,33,6,0.000268,12
https://openalex.org/W1556061918,An Introduction to the International Criminal Court,,24,14,0.000009,1
https://openalex.org/W1556205930,Torts and Rights,,24,16,0.000026,7
https://openalex.org/W1556249953,Republican liberty and border controls,,34,10,0.000138,2
https://openalex.org/W1557385359,Harm to Self,,18,16,0.000095,9
https://openalex.org/W1557385649,Fundamental legal conceptions as applied in judicial reasoning,,11,16,0.000488,9
https://openalex.org/W1558461042,Interpretation and Legal Theory,,25,6,0.003498,12
https://openalex.org/W1558581835,Beyond the Social Contract: Capabilities and Global Justice,,13,16,0.000008,2
https://openalex.org/W1559613097,Participation and Judicial Review: A Reply to Jeremy Waldron,,4,6,0.000096,5
https://openalex.org/W1563201617,On law and justice,,20,6,0.003115,12
https://openalex.org/W1563715884,A Common Law Theory of Judicial Review: The Living Tree,,4,6,0.000201,5
https://openalex.org/W1564062619,A Theory of Legal Argumentation: The Theory of Rational Discourse as Theory of Legal Justification,,33,6,0.001027,0
https://openalex.org/W1564524054,Philosophical foundations of tort law,,24,12,0.000353,21
https://openalex.org/W1565174900,General Theory of Norms,,24,4,0.000132,13
https://openalex.org/W1566220732,"Autonomy, self-knowledge, and liberal legitimacy",,29,11,0.000007,6
https://openalex.org/W1566598272,Teleological arguments and theory-based dialectics,,14,4,0.000043,0
https://openalex.org/W1566778104,Kant and Cosmopolitanism: The Philosophical Ideal of World Citizenship,,22,0,0.000004,12
https://openalex.org/W1567091907,The Gentle Civilizer of Nations: The Rise and Fall of International Law 1870–1960,,20,6,0.000074,12
https://openalex.org/W1567259932,Emotive Language in Argumentation,,14,4,0.000001,0
https://openalex.org/W1567271907,Principles of Criminal Law,,5,13,0.00003,11
https://openalex.org/W1567306273,An Introduction to Law and Regulation: Text and Materials,,16,1,0.000032,10
https://openalex.org/W1568392343,In Defense of Legal Positivism: Law without Trimmings,,9,6,0.006532,12
https://openalex.org/W1568887659,Exploring law's empire : the jurisprudence of Ronald Dworkin,,7,6,0.00025,12
https://openalex.org/W1570099351,On law and reason,,33,6,0.000389,0
https://openalex.org/W1570135578,A Theory of Secession: The Case for Political Self-Determination,,28,5,0.000098,2
https://openalex.org/W1570210665,Constitutionalism: Philosophical Foundations,,4,6,0.000085,5
https://openalex.org/W1571603731,Law and the modern mind,,2,6,0.00031,7
https://openalex.org/W1574390379,The Least Dangerous Branch: The Supreme Court at the Bar of Politics,,8,6,0.00044,5
https://openalex.org/W1574674163,Legal Justification by Optimal Coherence,,35,9,0.022441,5
https://openalex.org/W1574688956,Hans Kelsen's Pure Theory of Law: Legality and Legitimacy,,27,6,0.000208,12
https://openalex.org/W1575619584,Frame-based conceptual models of statute law,,24,4,0.000017,13
https://openalex.org/W1576429712,Constructing Legal Arguments with Rules in the Legal Knowledge Interchange Format (LKIF),,24,4,0.000001,0
https://openalex.org/W1577027906,Realistic Socio-Legal Theory: Pragmatism and A Social Theory of Law,,23,6,0.000209,12
https://openalex.org/W1577542310,Understanding Criminal Law,,5,13,0.000011,19
https://openalex.org/W1577632295,"The Fragility of Consensus: Public Reason, Diversity and Stability",,19,12,0.000017,6
https://openalex.org/W1578179010,The frontal cortex and the criminal justice system,,5,13,0,11
https://openalex.org/W1579308153,Causation in the law,,31,13,0.000087,7
https://openalex.org/W1579449604,Justice Beyond Borders: A Global Political Theory,,13,16,0.000083,2
https://openalex.org/W1582040817,"Statistical Evidence, Sensitivity, and the Legal Value of Knowledge",,22,13,0.000001,3
https://openalex.org/W1582197671,Justice for Hedgehogs,,16,6,0.00429,12
https://openalex.org/W1582972272,The Apology Ritual: A Philosophical Theory of Punishment,,5,13,0.000004,11
https://openalex.org/W1583439904,International Law's Relative Authority,,35,9,0.025934,5
https://openalex.org/W1583641956,Risks and Wrongs,,2,16,0.000053,7
https://openalex.org/W1584140962,Introduction to the Problems of Legal Theory: A Translation of the First Edition of the Reine Rechtslehre or Pure Theory of Law,,27,6,0.000178,12
https://openalex.org/W1584251685,Types and roles of legal ontologies,,24,4,0.000006,13
https://openalex.org/W1584634947,Evaluating a Legal Argument Progra: The BankXX Experiments,,14,4,0.000005,0
https://openalex.org/W1586995758,Criminal Law: The General Part,,5,13,0.000005,19
https://openalex.org/W1587380778,Rhetoric and the Rule of Law: A Theory of Legal Reasoning,,33,6,0.000205,5
https://openalex.org/W1587641581,"The rights of others : aliens, residents, and citizens",,29,11,0.000073,6
https://openalex.org/W1587784460,The Law of Restitution,,2,6,0.000022,7
https://openalex.org/W1588381368,Kant's Doctrine of Right: A Commentary,,22,0,0.000019,4
https://openalex.org/W1588542075,Free will and illusion,,5,13,0.000004,11
https://openalex.org/W1588847699,The Harm in Hate Speech,,16,3,0.000021,17
https://openalex.org/W1589420562,Answering for Crime: Responsibility and Liability in the Criminal Law,,5,13,0.000098,11
https://openalex.org/W1590457391,"Atrocity, Punishment, and International Law",,24,14,0.000046,1
https://openalex.org/W1590467032,Two Conceptions of Emotion in Criminal Law,,5,13,0.000001,19
https://openalex.org/W1592959975,Dialectical models in artificial intelligence and law,,14,4,0.000031,0
https://openalex.org/W1593671444,DiaLaw: On Legal Justification and Dialogical Models of Argumentation,,14,4,0.000077,0
https://openalex.org/W1593887675,Begriff und Geltung des Rechts,,7,6,0.000344,12
https://openalex.org/W1595012795,The Province of Jurisprudence Determined,,12,6,0.009989,12
https://openalex.org/W1595353434,The metaphysics of morals,,13,16,0.000835,7
https://openalex.org/W1596962160,Prosecuting International Crimes: Selectivity and the International Criminal Law Regime,,24,14,0.000002,1
https://openalex.org/W1597236456,Moral Repair: Reconstructing Moral Relations after Wrongdoing,,5,13,0.000002,11
https://openalex.org/W1597362725,Legal Reasoning and Political Conflict,,23,6,0.000215,12
https://openalex.org/W1598548519,From Normativity to Responsibility,,5,6,0.000199,12
https://openalex.org/W1600311062,A Comparison of Four Ontologies for the Design of Legal Knowledge Systems,,24,4,0.000012,13
https://openalex.org/W1602623594,"Minorities within Minorities: Multiculturalism and feminism: no simple question, no simple answers",,29,11,0.00003,6
https://openalex.org/W1605421440,An Introduction to Legal Reasoning,,33,4,0.000189,0
https://openalex.org/W1606033122,A Theory of Crimes Against Humanity,,24,14,0.000013,1
https://openalex.org/W1607757073,"On Dialogue Systems with Speech Acts, Arguments, and Counterarguments",,14,4,0.000004,0
https://openalex.org/W1608224782,Immanuel Kant: Practical philosophy: The metaphysics of morals (1797),,22,16,0.000016,7
https://openalex.org/W1616374570,A Structured Taxonomy of Responsibility Concepts,,5,13,0.000001,11
https://openalex.org/W162577003,"Civic Virtues: Rights, Citizenship, and Republican Liberalism",,18,16,0.000205,9
https://openalex.org/W1636613648,Proof Burdens and Standards,,14,4,0.000013,0
https://openalex.org/W1637265009,A neuroscientific approach to normative judgment in law and justice,,5,13,0,11
https://openalex.org/W164240929,What is Equality? Part 2: Equality of Resources,,32,16,0.000122,9
https://openalex.org/W164543311,The Moral Education Theory of Punishment,,5,13,0.000099,11
https://openalex.org/W1647597836,Argument Schemes for Legal Case-based Reasoning,,14,4,0.000016,0
https://openalex.org/W165840446,"Actions, intentions, and consequences: the doctrine of double effect.",,24,16,0.005237,8
https://openalex.org/W1660713213,Pierson vs. Post RevisitedA Reconstruction using the Carneades Argumentation Framework,,14,4,0.000007,0
https://openalex.org/W1686779877,A note on dimensions and factors,,14,4,0.000073,0
https://openalex.org/W169219175,Rescuing justice and equality,,36,16,0.001616,9
https://openalex.org/W1705033826,Autonomy and the Challenges to Liberalism: Moral Autonomy and Personal Autonomy,,29,11,0.00001,6
https://openalex.org/W174389237,ON ANALOGICAL REASONING,,33,4,0.000056,0
https://openalex.org/W1752804396,"Epistemology and ontology in core ontologies: FOLaw and LRI-Core, two core ontologies for law",,24,4,0.000009,13
https://openalex.org/W1752934815,LegalRuleML: XML-based rules and norms,,24,4,0,0
https://openalex.org/W175463262,The concept of a legal system,,25,6,0.003295,12
https://openalex.org/W1769728822,"Stellenindex und Konkordanz zum Naturrecht Feyerabend, Teilband I: Einleitung des Naturrechts Feyerabend",,22,0,0.000003,4
https://openalex.org/W177543178,Race and Essentialism in Feminist Legal Theory,,31,11,0.000026,9
https://openalex.org/W1783030812,The authority of the state,,21,16,0.004627,9
https://openalex.org/W1784315468,Remedies for Expanding Liability,,29,16,0.000001,7
https://openalex.org/W1803159072,Modelling Defeasibility in Law: Logic or Procedure?,,14,4,0.000018,0
https://openalex.org/W1814152743,Meeting Principles and Lifeworlds Halfway: Jürgen Habermas on the Future of Europe:,,29,11,0.000008,6
https://openalex.org/W1814366986,Two Views of Collective Rights,,0,8,0.000106,9
https://openalex.org/W1814854443,Abandoning the Abandonment Objection: Luck Egalitarian Arguments for Public Insurance,,32,16,0.000016,9
https://openalex.org/W181618895,An Institutional Theory of Law,,20,7,0.025427,8
https://openalex.org/W1827110031,Use and reuse of legal ontologies in knowledge engineering and information management,,24,4,0.000011,13
https://openalex.org/W1838319998,The Idea of Public Law,,22,6,0.000073,12
https://openalex.org/W1843303664,The Negotiable Constitution: On the Limitation of Rights,,33,6,0.000089,5
https://openalex.org/W1852989794,AFTER INCOMPATIBILISM: A NATURALISTIC DEFENSE OF THE REACTIVE ATTITUDES*,,5,13,0.000001,11
https://openalex.org/W1853490720,Free Will and Luck,,5,13,0.000001,11
https://openalex.org/W1859893825,A Permissive Theory of Territorial Rights,,31,5,0.000006,2
https://openalex.org/W1861517128,Sentencing and criminal justice,,5,13,0.000005,11
https://openalex.org/W1861935076,"Sensitivity, Causality, and Statistical Evidence in Courts of Law",,22,13,0,3
https://openalex.org/W1871198611,Prescribing Institutions Without Ideal Theory,,34,10,0.000025,2
https://openalex.org/W1872390457,Democracy Is Not Intrinsically Just,,29,11,0.000057,6
https://openalex.org/W1876069,The Relation Between Forward-Looking and Backward-Looking Responsibility,,5,13,0.000001,11
https://openalex.org/W1879898357,The Pleadings Game: an exercise in computational dialectics,,14,4,0.000116,0
https://openalex.org/W1879914892,A hybrid rule --- neural approach for the automation of legal reasoning in the discretionary domain of family law in Australia,,14,4,0.000028,0
https://openalex.org/W188032603,Severe Poverty as a Human Rights Violation,,13,16,0.000003,2
https://openalex.org/W1882194402,The prisoners' dilemma political economy and punishment in contemporary democracies,,27,13,0.000001,11
https://openalex.org/W1885738906,Forms Liberate: Reclaiming the Jurisprudence of Lon L Fuller,,8,6,0.000228,12
https://openalex.org/W1886723030,Why people obey the law,,31,6,0.000378,12
https://openalex.org/W1892499457,The Ends of Harm: The Moral Foundations of Criminal Law,,24,13,0.00003,11
https://openalex.org/W1894614310,Ideal vs. Non-ideal Theory: A Conceptual Map,,34,10,0.000076,2
https://openalex.org/W1898777572,Who is Afraid of Radical Pluralism? Legal Order and Political Stability in the Postnational Space*,,35,9,0.020266,5
https://openalex.org/W1899358847,Legitimacy without the Duty to Obey,,34,16,0.000327,9
https://openalex.org/W191925210,The Carneades Argumentation FrameworkUsing Presumptions and Exceptions to Model Critical Questions,,14,4,0.000008,0
https://openalex.org/W1919878871,Fairness versus Welfare,,2,6,0.000069,7
https://openalex.org/W1922540135,The concept of human dignity and the realistic utopia of human rights,,16,1,0.002116,10
https://openalex.org/W1936596455,Cognitive Carpentry: A Blueprint for How to Build a Person,,14,4,0.000054,0
https://openalex.org/W1952168506,Reasons and Intentions in Law and Practical Agency,,27,15,0.955287,20
https://openalex.org/W1953136326,Modeling Legal Argument: Reasoning with Cases and Hypotheticals,,14,4,0.000115,0
https://openalex.org/W1960628715,Robert P. Burns: Kafka’s Law: The Trial and American Criminal Justice,,31,6,0.000159,12
https://openalex.org/W1963741677,MORALITY AND BAD LUCK,,5,13,0,11
https://openalex.org/W1963817009,Islands in a sea of obligation: Limits of the duty to rescue,,28,5,0.000048,2
https://openalex.org/W1963876136,Politics and International Legal Obligation,,33,4,0.000013,0
https://openalex.org/W1965823236,"Judicial obligation, precedent and the common law",,7,6,0.001176,12
https://openalex.org/W1966116708,A Guide to Critical Legal Studies,,23,6,0.000144,12
https://openalex.org/W1966340639,Justice as Fairness : A Restatement,,36,16,0.000309,9
