Id,Label,timeset,stat_inf_class,modularity.class,eigen,modularity_class
https://openalex.org/W2045151352,Hard Determinism and Punishment: A Practical Reductio,,5,13,0,11
https://openalex.org/W2045182421,Theory based explanation of case law domains: 38,,14,4,0.00003,0
https://openalex.org/W2045298523,How to Say Things with Walls,,5,13,0.000011,11
https://openalex.org/W2047379627,The Tribunal of Reason: Kant and the Juridical Nature of Pure Reason,,22,0,0.000003,4
https://openalex.org/W2047661196,Toward a Liberal Theory of Political Obligation,,0,8,0.000878,9
https://openalex.org/W2048175845,On Benefiting from Injustice,,28,5,0.000006,2
https://openalex.org/W2048451539,Conceptual organization of case law knowledge bases,,14,4,0.000011,0
https://openalex.org/W2048600620,The British Nationality Act as a logic program,,14,4,0.000066,0
https://openalex.org/W2048636620,The nature of rights.,,11,16,0.00035,9
https://openalex.org/W2048893520,The Trolley Problem as a Problem for Libertarians,,29,11,0.000003,6
https://openalex.org/W2049679091,Argumentation and Interpretation in Law,,33,6,0.000114,12
https://openalex.org/W2050223480,Automatically classifying case texts and predicting outcomes,,14,4,0.000006,0
https://openalex.org/W2050497363,Elements of a Theory of Human Rights,,13,16,0.000126,2
https://openalex.org/W2051076626,Transformations of Citizenship: The Case of Contemporary Europe,,34,10,0.000081,2
https://openalex.org/W2051784609,Understanding precedents in a temporal context of evolving legal doctrine,,14,4,0.000015,0
https://openalex.org/W2051892360,On Hart's Way Out,,9,6,0.00537,12
https://openalex.org/W2051964555,Constitutional Quandaries and Critical Elections,,18,16,0.000023,9
https://openalex.org/W2052059337,A Cosmopolitan Philosophy of International Law? A Realist Approach,,6,16,0.000066,9
https://openalex.org/W2052201324,Black's Law Dictionary,,14,4,0.000012,0
https://openalex.org/W2052351877,Detecting change in legal concepts,,14,4,0.000027,0
https://openalex.org/W2052671436,Non-Tracing Cases of Culpable Ignorance,,5,13,0,11
https://openalex.org/W2052718919,Killing Minimally Responsible Threats,,24,14,0.000001,1
https://openalex.org/W2052916539,A computational model of ratio decidendi,,14,4,0.000059,0
https://openalex.org/W2053014455,The Absolute Prohibition of Lying and the Origins of the Casuistry of Mental Reservation: Augustinian Arguments and Thomistic Developments,,10,7,0.066718,8
https://openalex.org/W2053659565,Still wrong after all these years,,10,7,0.063069,8
https://openalex.org/W2053716189,Isomorphism and legal knowledge based systems,,24,4,0.000032,0
https://openalex.org/W2053839853,Interpreting statutory predicates,,14,4,0.000043,0
https://openalex.org/W2053945366,Natural Law and Justice,,2,6,0.000059,7
https://openalex.org/W2054329666,An ontology in OWL for legal case-based reasoning,,14,4,0.000003,0
https://openalex.org/W2054504893,Feminism and the power of law,,31,11,0.000023,12
https://openalex.org/W2055244532,Kelsen's Theory of the Basic Norm,,22,0,0.00151,4
https://openalex.org/W2055510916,The hybrid nature of promissory obligation,,24,12,0.00061,21
https://openalex.org/W2055647644,A method for the computational modelling of dialectical argument with dialogue games,,14,4,0.00001,0
https://openalex.org/W2056397859,Autonomy and the Challenges to Liberalism: New Essays,,29,11,0.000012,6
https://openalex.org/W2056630576,Relating Carneades with abstract argumentation via the ASPIC + framework for structured argumentation,,14,4,0.000001,0
https://openalex.org/W2057257255,A Defense of International Criminal Law,,0,8,0.000446,9
https://openalex.org/W2057829124,Some arguments about legal arguments,,14,4,0.00005,0
https://openalex.org/W2058150518,The morality of law,,17,6,0.002987,12
https://openalex.org/W2059214530,"Moral Responsibility, Manipulation Arguments, and History: Assessing the Resilience of Nonhistorical Compatibilism",,5,13,0,11
https://openalex.org/W2060483271,Statutory Lawlessness and Supra-Statutory Law (1946),,17,7,0.299512,8
https://openalex.org/W2060498353,Law and Disagreement,,4,6,0.001586,5
https://openalex.org/W2060969662,Moral ignorance and blameworthiness,,5,13,0.000001,11
https://openalex.org/W2061189098,Constitutional democracy and the legitimacy of judicial review,,4,6,0.000072,5
https://openalex.org/W2061272009,Some thoughts about retributivism,,5,13,0.000142,11
https://openalex.org/W2061701700,Law as fact,,20,6,0.000316,12
https://openalex.org/W2061940329,"Law, Liberty, and Morality",,26,16,0.000609,11
https://openalex.org/W2062788414,Rethinking Criminal Law,,5,13,0.000062,19
https://openalex.org/W2063412381,The Common Place of Law: Stories from Everyday Life,,31,14,0.000036,7
https://openalex.org/W2063487684,The harshness objection : is luck egalitarianism too harsh on the victims of option luck?,,32,16,0.000028,9
https://openalex.org/W2063764015,Using argument schemes for hypothetical reasoning in law,,14,4,0.000011,0
https://openalex.org/W2064023733,Explanationism All the Way Down,,14,4,0,0
https://openalex.org/W2064070332,Poverty and Criminal Responsibility,,5,13,0.000006,11
https://openalex.org/W2064238556,Proportionality in the Philosophy of Punishment,,31,13,0.000009,11
https://openalex.org/W2065218325,DIGNITY AS A MORAL CONCEPT,,16,8,0.000005,10
https://openalex.org/W2065470514,"COERCION, OWNERSHIP, AND THE REDISTRIBUTIVE STATE: JUSTIFICATORY LIBERALISM'S CLASSICAL TILT",,29,11,0.000037,6
https://openalex.org/W2065776138,Facilitating case comparison using value judgments and intermediate legal concepts,,14,4,0.00001,0
https://openalex.org/W2065800506,The value of a promise,,24,12,0.000527,21
https://openalex.org/W2065820028,The rational reconstruction of argumentation referring to consequences and purposes in the application of legal rules: a pragma-dialectical perspective,,33,6,0.000029,5
https://openalex.org/W2065946385,"On Respect, Authority, and Neutrality: A Response",,35,9,0.000646,9
https://openalex.org/W2066663455,"Libertarianism, Entitlement, and Responsibility",,32,16,0.000268,9
https://openalex.org/W2066750905,Law as Interpretation,,30,6,0.001013,12
https://openalex.org/W2067074281,Authority and Reasons: Exclusionary and Second‐Personal*,,35,9,0.008763,9
https://openalex.org/W2067393911,Hart’s Methodological Positivism,,9,6,0.008975,12
https://openalex.org/W2067560843,Why Egalitarians Should Not Care About Equality,,32,16,0.000012,9
https://openalex.org/W2068144010,The pleadings game: formalizing procedural justice,,14,4,0.000017,0
https://openalex.org/W2068236960,Review essay / making up our minds: Can law survive cognitive science?,,2,6,0.000012,7
https://openalex.org/W2068253240,The ethics of punishment: Correctional practice implications,,5,13,0.000001,11
https://openalex.org/W2069176561,Argument-based extended logic programming with defeasible priorities,,14,4,0.000025,0
https://openalex.org/W2069321861,"Ontological requirements for analogical, teleological, and hypothetical legal reasoning",,14,4,0.000017,0
https://openalex.org/W2069542618,Justice As Impartiality,,36,16,0.000285,9
https://openalex.org/W2070053282,The Constitutionalization of International Law and the Legitimation Problems of a Constitution for World Society,,35,9,0.010528,5
https://openalex.org/W2070486087,The Expressive Function of Punishment,,5,13,0.000083,11
https://openalex.org/W2070723458,"Argument from Analogy in Law, the Classical Tradition, and Recent Theories",,33,4,0.000008,0
https://openalex.org/W2071578102,A Right to Do Wrong,,11,16,0.000555,9
https://openalex.org/W2072078569,Distributive Justice: Some Addenda,,6,16,0.000008,9
https://openalex.org/W2072095375,Whose Sovereignty? Empire versus International Law,,22,1,0.000046,5
https://openalex.org/W2072193593,Legal Reality: A Naturalist Approach to Legal Ontology,,37,6,0.000124,12
https://openalex.org/W2072229209,Practical Reason and Norms,,25,6,0.020794,12
https://openalex.org/W2073010516,A matter of principle,,12,6,0.001362,12
https://openalex.org/W2073410822,Philosophical Anarchism and Political Disobedience,,21,16,0.000444,9
https://openalex.org/W2073421736,"Character, purpose, and criminal responsibility",,5,13,0.000002,19
https://openalex.org/W2073425274,Changing legal systems: legal abrogations and annulments in Defeasible Logic,,24,4,0.000019,0
https://openalex.org/W2073540959,The Rule of Law in Contemporary Liberal Theory,,23,6,0.000185,12
https://openalex.org/W2073784765,Human dignity as an essentially contested concept,,16,8,0.000007,10
https://openalex.org/W2074687777,Appropriate Responses and Preventive Benefits: Justifying Censure and Hard Treatment in Legal Punishment.,,5,13,0.000006,11
https://openalex.org/W2074839066,Law and Exclusionary Reasons,,27,15,0.615963,20
https://openalex.org/W2075438625,Justifying legal punishment,,5,13,0.00001,11
https://openalex.org/W2076120700,On the Importance of History for Responsible Agency,,5,13,0.000001,11
https://openalex.org/W2076483551,Grounding the Rule of Law,,23,6,0.000078,12
https://openalex.org/W2076754485,A logical framework for modelling legal argument,,14,4,0.000014,0
https://openalex.org/W2076841323,Motive and criminal liability,,26,6,0.00006,11
https://openalex.org/W2077539373,A sociological theory of law,,31,6,0.000073,12
https://openalex.org/W2077577163,Human rights and correctional clinical practice,,5,13,0.000002,11
https://openalex.org/W2077913887,Solving a Murder Case by Asking Critical Questions : An Approach to Fact-Finding in Terms of Argumentation and Story Schemes,,14,4,0.000001,0
https://openalex.org/W2078644730,Disagreement in Politics,,29,16,0.002716,9
https://openalex.org/W2079691384,"Pufendorf on Morality, Sociability, and Moral Powers",,10,2,0.001056,23
https://openalex.org/W2080251764,Responsibility as Answerability,,5,13,0.000001,11
https://openalex.org/W2080406782,"Kant's theory of punishment: Deterrence in its threat, retribution in its execution",,5,13,0.000018,11
https://openalex.org/W2080433285,"Practical Principles, Moral Truth, and Ultimate Ends",,10,7,0.02514,8
https://openalex.org/W2080575678,Permissions and obligations in hierarchical normative systems,,20,6,0.000014,13
https://openalex.org/W2080647564,Liability for the Bad Behaviour of Others,,18,3,0.000043,17
https://openalex.org/W2080764832,Faultless mistake of fact: Justification or excuse?,,5,13,0,11
https://openalex.org/W2081073222,The law as a system of signs,,33,6,0.000024,7
https://openalex.org/W2081664466,Can Neurological Evidence Help Courts Assess Criminal Responsibility? Lessons from Law and Neuroscience,,5,13,0,11
https://openalex.org/W2082016936,DiaLaw: a dialogical framework for modeling legal reasoning,,14,4,0.000012,0
https://openalex.org/W2082063548,The Rawlsian Theory of International Law,,6,16,0.000059,9
https://openalex.org/W2082267307,"Constitutive Rules, Language, and Ontology",,22,16,0.000048,12
https://openalex.org/W2082455105,Two Views of the Nature of the Theory of Law: A Partial Comparison,,27,15,0.383476,20
https://openalex.org/W2082605766,"Distributive Justice, State Coercion, and Autonomy",,28,5,0.000199,2
https://openalex.org/W2083201648,The Authority of Law: Essays on Law and Morality,,8,6,0.006564,12
https://openalex.org/W2083233387,"One world, many peoples: international justice in John Rawls’s The Law of Peoples",,28,16,0.003043,9
https://openalex.org/W2084004968,Monological reason-based logic: a low level integration of rule-based reasoning and case-based reasoning,,14,4,0.000099,0
https://openalex.org/W2084202217,The right to private property,,20,16,0.000397,7
https://openalex.org/W2084234373,A theory of legal reasoning and a logic to match,,14,4,0.000047,0
https://openalex.org/W2084269381,"Comparative Assessments of Justice, Political Feasibility, and Ideal Theory",,34,10,0.000014,2
https://openalex.org/W2085537356,Inclusive Legal Positivism,,9,6,0.017109,12
https://openalex.org/W2086841517,Introduction to the study of the law of the Constitution,,23,6,0.000862,12
https://openalex.org/W2086971778,Morality and the retributive emotions,,5,13,0.000023,11
https://openalex.org/W2087470807,Not Just Deserts: A Republican Theory of Criminal Justice,,5,13,0.000029,11
https://openalex.org/W2087567709,Reasoning with cases and hypotheticals in HYPO,,14,4,0.000046,0
https://openalex.org/W2087743616,"Consequentialism, Moral Responsibility, and the Intention/ Foresight Distinction",,5,13,0.000012,11
https://openalex.org/W2087843564,Arguments and cases: An inevitable intertwining,,14,4,0.000112,0
https://openalex.org/W2087964658,Argument moves in a rule-guided domain,,14,4,0.000026,0
https://openalex.org/W2088211885,Law as an autopoietic system,,31,6,0.000095,12
https://openalex.org/W2089679326,From logic to dialectics in legal argument,,14,4,0.000051,0
https://openalex.org/W2090226479,Moral Responsibility and the Psychopath,,5,13,0,11
https://openalex.org/W2090435642,Natural Rights Theories: Their Origin and Development,,20,16,0.000379,9
https://openalex.org/W2090977758,Guilty bystanders? On the legitimacy of duty to rescue statutes,,28,5,0.000106,2
https://openalex.org/W2092291780,Hans Kelsen's Earliest Legal Theory: Critical Constructivism,,22,0,0.000254,4
https://openalex.org/W2092703685,Doing justice to rights and values: teleological reasoning and proportionality,,14,4,0.000054,0
https://openalex.org/W2092829147,The boundary problem in democratic theory: why the demos should be bounded by the state,,22,11,0.000015,2
https://openalex.org/W2092981632,Law and Revolution: The Formation of the Western Legal Tradition,,20,6,0.000084,12
https://openalex.org/W2093412334,A model of argumentation and its application to legal reasoning,,14,4,0.000019,0
https://openalex.org/W2094073190,On the Structure of Legal Principles,,33,6,0.000306,5
https://openalex.org/W2094143258,The Gist of Excuses,,5,13,0.000006,19
https://openalex.org/W2095139256,"Global Prescriptions: The Production, Exportation, and Importation of a New Legal Orthodoxy",,31,6,0.000008,5
https://openalex.org/W2095259447,The Principle of Fairness and Free-Rider Problems,,2,16,0.00096,9
https://openalex.org/W2095316439,Priorities of Global Justice,,28,5,0.00007,2
https://openalex.org/W2095434898,Free Speech: A Philosophical Enquiry,,16,3,0.000033,17
https://openalex.org/W2096182694,Back to the Future: Dimensions Revisited,,14,4,0.000034,0
https://openalex.org/W2096251355,Are Rules All an Umpire Has to Work With,,7,6,0.00002,12
https://openalex.org/W2096696725,International Distributive Justice,,6,16,0.000061,9
https://openalex.org/W2096945010,"For the law, neuroscience changes nothing and everything.",,5,13,0.000005,11
https://openalex.org/W2097794246,Approaches to text mining arguments from legal cases,,14,4,0,0
https://openalex.org/W2098654548,Responsibilities for Poverty‐Related Ill Health,,28,5,0.000102,2
https://openalex.org/W2099215247,Formalizing legal coherence,,14,4,0.000118,0
https://openalex.org/W2099452173,Legal modeling and automated reasoning with ON—LINE,,24,4,0.000022,13
https://openalex.org/W2099948109,The law as a dynamic interconnected system of states of affairs: a legal top ontology,,24,4,0.000038,13
https://openalex.org/W2100148410,The case for demoicracy in the European Union,,34,10,0.000053,2
https://openalex.org/W2100444068,The dual nature of law,,10,7,0.050569,8
https://openalex.org/W2101008763,The Very Idea of Popular Sovereignty: “We the People” Reconsidered,,18,16,0.00002,9
https://openalex.org/W2101216793,Global Bukowina: Legal pluralism in the world society,,31,6,0.000122,5
https://openalex.org/W2101637700,Punishment as Language,,5,13,0.000026,11
https://openalex.org/W2101757732,Natural law;: An introduction to legal philosophy,,20,16,0.000032,9
https://openalex.org/W2101771477,Transnational communities and the concept of law,,31,15,0.007404,5
https://openalex.org/W2102449858,Compensation and responsibility,,32,16,0.000006,9
https://openalex.org/W2102550883,The Responsibility of the Psychopath Revisited,,5,13,0,11
https://openalex.org/W2102730207,Beyond the Separability Thesis: Moral Semantics and the Methodology of Jurisprudence †,,9,6,0.009765,12
https://openalex.org/W2103119110,Against Autonomy: Justifying Coercive Paternalism,,19,16,0.00001,9
https://openalex.org/W2103121778,Neuroscientific challenges to free will and responsibility,,5,13,0,11
https://openalex.org/W2104421108,Judicial Review of Legislation: A Comparative Study of the Austrian and the American Constitution,,4,9,0.000051,5
https://openalex.org/W2104759511,Case Law versus Statute Law: An Evolutionary Comparison,,2,6,0.000002,7
https://openalex.org/W2104802723,The missing link revisited: The role of teleology in representing legal argument,,14,4,0.000081,0
https://openalex.org/W2105250754,A Global State of Emergency or the Further Constitutionalization of International Law: A Pluralist Approach,,22,9,0.000119,5
https://openalex.org/W2106063398,Political Theory of Empire and Imperialism,,29,1,0,10
https://openalex.org/W2106536319,Dialectical argumentation with argumentation schemes: an approach to legal logic,,14,4,0.00002,0
https://openalex.org/W2107025559,A Predictive Role for Intermediate Legal Concepts,,14,4,0.000014,0
https://openalex.org/W2107758351,"On the Demos and Its Kin: Nationalism, Democracy, and the Boundary Problem",,22,11,0.000025,2
https://openalex.org/W2108588394,Constitutional Law of Canada,,8,6,0.000072,5
https://openalex.org/W2109132676,An Integrated View on Rules and Principles,,14,4,0.000054,0
https://openalex.org/W2109305266,"Property, Rights, and Freedom*",,32,16,0.000245,9
https://openalex.org/W2109409153,The Carneades model of argument and burden of proof,,14,4,0.000027,0
https://openalex.org/W2109498583,The Act Itself,,24,16,0.000041,9
https://openalex.org/W2109755782,IS FINNIS WRONG,,27,15,0.789226,20
https://openalex.org/W2109911083,The New Legal Pluralism,,31,6,0.000029,5
https://openalex.org/W2110386669,"No Global Demos, No Global Democracy? A Systematization and Critique",,34,10,0.000109,2
https://openalex.org/W2110878939,Representation of formal dispute with astanding order,,14,4,0.000018,0
https://openalex.org/W2111542911,A case-based system for trade secrets law,,14,4,0.000062,0
https://openalex.org/W2112170319,Justice in Ideal Theory: A Refutation:,,28,16,0.002448,9
https://openalex.org/W2112816268,Rules and Norms: Requirements for Rule Interchange Languages in the Legal Domain,,24,4,0.000006,0
https://openalex.org/W2112877948,A language for legal Discourse I. basic features,,24,4,0.000022,13
https://openalex.org/W2113169658,"Rules, reasons, arguments : formal studies of argumentation and defeat",,14,4,0.00008,0
https://openalex.org/W2113232279,World Poverty and Human Rights,,13,16,0.000217,2
https://openalex.org/W2113581002,Making Men Moral: Civil Liberties And Public Morality,,26,16,0.00016,11
https://openalex.org/W2113598466,Distributive and relational equality,,32,16,0.000006,9
https://openalex.org/W2114851496,Reflection and Responsibility,,5,13,0,11
https://openalex.org/W2115449662,Argument construction and reinstatement in logics for defeasible reasoning,,14,4,0.000002,0
https://openalex.org/W2116057227,THE RULE OF LAW,,8,6,0.000617,12
https://openalex.org/W2116645954,Democratic Theory and Border Coercion No Right to Unilaterally Control Your Own Borders,,22,11,0.000476,2
https://openalex.org/W2117090172,On balancing and subsumption: A structural comparison,,33,6,0.001154,5
https://openalex.org/W2117729983,The More the Merrier? A New Take on Legal Pluralism:,,31,6,0.000014,5
https://openalex.org/W2117781069,An empirical investigation of reasoning with legal cases through theory construction and application,,14,4,0.000022,0
https://openalex.org/W2118224853,The Ideal Socio-Legal Order. Its “Rule of Law” Dimension,,23,6,0.000089,12
https://openalex.org/W2119419375,Argumentation structures that integrate dialectical and non-dialectical reasoning,,14,4,0.000001,0
https://openalex.org/W2119540646,Human Dignity and judicial Interpretation of Human Rights,,16,1,0.001717,10
https://openalex.org/W2119549174,Property Rights in Persons,,32,16,0.000274,9
https://openalex.org/W2119686943,SAY WHAT? A CRITIQUE OF EXPRESSIVE RETRIBUTIVISM,,5,13,0.000007,11
https://openalex.org/W2119752945,Republicanism: A Theory of Freedom and Government,,37,16,0.000194,9
https://openalex.org/W2119912892,An Approach To The Problems Of Punishment,,5,13,0.000015,11
https://openalex.org/W2120225427,"Punishing the Awkward, the Stupid, the Weak, and the Selfish: The Culpability of Negligence",,5,13,0.000001,11
https://openalex.org/W2120335993,"Arguments, scenarios and probabilities: connections between three normative frameworks for evidential reasoning",,14,4,0,0
https://openalex.org/W2120345160,"Justice, Disagreement and Democracy",,34,10,0.000127,2
https://openalex.org/W2120413618,Law as justice,,10,7,0.067623,8
https://openalex.org/W2120704806,The European Nation State. Its Achievements and Its Limitations. On the Past and Future of Sovereignty and Citizenship,,29,1,0.000007,6
https://openalex.org/W2122055745,General theory of law and state,,27,6,0.008854,12
https://openalex.org/W2122165510,Taking Rights Seriously,,3,6,0.003584,12
https://openalex.org/W2122198834,On reconstructive legal and political theory,,29,11,0.000032,6
https://openalex.org/W2122730002,The Physiognomy of Responsibility,,5,13,0.000001,11
https://openalex.org/W2123456596,The Pull of the Policy Audience,,8,14,0.000008,7
https://openalex.org/W2123761774,An artificial intelligence approach to legal reasoning,,14,4,0.000116,0
https://openalex.org/W2125667731,The appeal and danger of a new refugee convention,,28,5,0.000058,2
https://openalex.org/W2127233441,Law and What I Truly Should Decide,,7,6,0.005059,12
https://openalex.org/W2128056979,Obligation and Consent—I,,21,16,0.000443,9
https://openalex.org/W2129016947,The Enforcement of Morals,,26,16,0.000233,11
https://openalex.org/W2129177500,Punishment and repentance,,5,13,0.000004,11
https://openalex.org/W2129213188,Argumentation Schemes for Presumptive Reasoning,,14,4,0.000024,0
https://openalex.org/W2129380988,The Reliance Interest in Contract Damages,,30,12,0.001759,7
https://openalex.org/W2129560319,Claiming Rights across Borders: International Human Rights and Democratic Sovereignty,,29,1,0.00002,6
https://openalex.org/W2130069538,"Global Justice, Freedom of Movement and Democratic Citizenship",,22,11,0.000003,2
https://openalex.org/W2130107788,"Abductive, presumptive and plausible arguments",,14,4,0,0
https://openalex.org/W2131487408,New Challenges to the Rationality Assumption,,31,13,0.000001,7
https://openalex.org/W2131795851,An exercise in formalising teleological case-based reasoning,,14,4,0.000082,0
https://openalex.org/W2133844203,Moral Luck Defended,,5,13,0,11
https://openalex.org/W2133882944,"Authority, Law and Morality",,27,15,0.298196,20
https://openalex.org/W2134211747,AGATHA: using heuristic search to automate the construction of case law theories,,14,4,0.000013,0
https://openalex.org/W2134303121,Towards a Formal and Implemented Model of Argumentation Schemes in Agent Communication,,14,4,0.000001,0
https://openalex.org/W2136970245,"Law, plans and practical reason",,25,6,0.003562,12
https://openalex.org/W2136979587,"LAW OF STATES, LAW OF PEOPLES:",,6,16,0.000032,9
https://openalex.org/W2137074370,JOEL FEINBERG AND THE JUSTIFICATION OF HARD PATERNALISM,,18,16,0.000009,9
https://openalex.org/W2138293185,Methodology in jurisprudence,,9,6,0.009086,12
https://openalex.org/W2138337462,Norm and Action: A Logical Enquiry.,,20,6,0.000045,13
https://openalex.org/W2138878586,A Hard-line Reply to Pereboom’s Four-Case Manipulation Argument,,5,13,0.000001,11
https://openalex.org/W2138889939,"Constitutional Rights, Balancing, and Rationality",,33,6,0.000252,5
https://openalex.org/W2139100182,Towards Juristocracy: The Origins and Consequences of the New Constitutionalism,,4,6,0.000123,5
https://openalex.org/W2139276293,A New Philosophy for International Law,,35,15,0.335864,20
https://openalex.org/W2140125709,"Liberalism, Samaritanism, and Political Legitimacy",,0,8,0.000662,9
https://openalex.org/W2140201308,Fundamentals of ethics,,10,7,0.000477,8
https://openalex.org/W2140256766,A Formal Model of Legal Argumentation,,14,4,0.000045,0
https://openalex.org/W2140658287,The Strategic Constitution,,30,6,0.000011,5
https://openalex.org/W2140773463,What Is Political Science For,,29,1,0,6
https://openalex.org/W2140857248,IX—Responsibility and the Consequences of Choice,,32,16,0.000029,9
https://openalex.org/W2141322619,Argumentation and standards of proof,,14,4,0.000005,0
https://openalex.org/W2141969371,"Doing What Comes Naturally: Change, Rhetoric and the Practice of Theory in Literary and Legal Studies",,30,6,0.000057,7
https://openalex.org/W2142352953,NATURAL LAW JURISPRUDENCE,,10,7,0.054051,8
https://openalex.org/W2142954222,DO PRECEDENTS CREATE RULES,,33,4,0.000139,0
https://openalex.org/W2143178215,Refugee Rights: Against Expanding the Definition of a “Refugee” and Unilateral Protection Elsewhere,,28,5,0.000051,2
https://openalex.org/W2143401280,Republican Theory and Criminal Punishment,,5,13,0.000004,11
https://openalex.org/W2143450754,Sense-making software for crime investigation: how to combine stories and arguments?,,14,4,0.000005,0
https://openalex.org/W2144523543,The Gender Question in Criminal Law,,31,11,0.000001,19
https://openalex.org/W2144625734,IV*—FREE WILL: FROM NATURE TO ILLUSION,,5,13,0,11
https://openalex.org/W2144724894,Taking Constitutionalism beyond the State,,22,9,0.001834,5
https://openalex.org/W2145519348,"Decolonising International Law: Development, Economic Growth and the Politics of Universality",,20,6,0.000002,12
