"id","centrality","Label","stat_inf_class","Modularity.Class","display_name","eigen"
"https://openalex.org/W1555368823",NA,"",NA,0,"Argumentation in Legal Reasoning",0.00795108281522711
"https://openalex.org/W588049860",NA,"",NA,12,"Analyzing law : new essays in legal theory",0.0682645101775378
"https://openalex.org/W2493891900",NA,"",NA,7,"Punishment, Responsibility, and Justice",0.0099639964037745
"https://openalex.org/W1495360909",NA,"",NA,12,"Oxford studies in philosophy of law",0.0844327159083244
"https://openalex.org/W2073020714",NA,"",NA,11,"“Ain’t No One Here But Us Social Forces”: Constructing the Professional Responsibility of Engineers",0.0098749605787305
"https://openalex.org/W2110474404",NA,"",NA,19,"Choice, Character, and Excuse",0.0122487901121545
"https://openalex.org/W2039387416",NA,"",NA,5,"Who Shall Interpret? The Quest for the Ultimate Constitutional Interpreter",0.0163092680991313
"https://openalex.org/W3125598080",NA,"",NA,12,"The Social Construction of the Concept of Law: A Reply to Julie Dickson",0.10870669135727
"https://openalex.org/W2065254678",NA,"",NA,12,"Fuller's internal point of view",0.0356402905312588
"https://openalex.org/W2013559766",NA,"",NA,11,"The Limits of the Harm Principle",0.00948247122552629
"https://openalex.org/W638934820",NA,"",NA,9,"Collective Rights: A Legal Theory",0.00783538328271299
"https://openalex.org/W2012297130",NA,"",NA,5,"On Law and Disagreement. Some Comments on “Interpretative Pluralism”",0.0140324562955607
"https://openalex.org/W2069502151",NA,"",NA,0,"Formalising ordinary legal disputes: a case study",0.0105861971841601
"https://openalex.org/W2083584323",NA,"",NA,0,"Formalising argumentative story-based analysis of evidence",0.0173433387057459
"https://openalex.org/W2083839306",NA,"",NA,21,"Duress, deception, and the validity of a promise",0.005469249135452
"https://openalex.org/W2476557584",NA,"",NA,11,"The Philosophy of Criminal Law",0.0117687897336459
"https://openalex.org/W599602422",NA,"",NA,1,"Writing History in International Criminal Trials",0.00143536538346054
"https://openalex.org/W1603024916",NA,"",NA,0,"Transparency and doubt: Understanding and interpretation in pragmatics and in law",0.0148870624513499
"https://openalex.org/W1985419471",NA,"",NA,9,"Why the Basic Structure",0.0102670529076433
"https://openalex.org/W2004645244",NA,"",NA,2,"The Capability Approach and the Debate Between Humanist and Political Perspectives on Human Rights. A Critical Survey",0.00747641491983739
"https://openalex.org/W1998756099",NA,"",NA,0,"On the role of prototypes in appellate legal argument (abstract)",0.0165997590845041
"https://openalex.org/W2530414525",NA,"",NA,11,"Compatibilism and Retributivist Desert Moral Responsibility: On What is of Central Philosophical and Practical Importance",0.00432838816062616
"https://openalex.org/W2048577122",NA,"",NA,2,"The moral and legal responsibility of the bad Samaritan",0.00411949930200849
"https://openalex.org/W3148867839",NA,"",NA,11,"Justice and Punishment: The Rationale of Coercion",0.0221668419680266
"https://openalex.org/W2201348529",NA,"",NA,7,"Kant and Property Rights in Body Parts",0.00438032688183309
"https://openalex.org/W2489881167",NA,"",NA,11,"Constructing a Theory of Punishment, Desert, and the Distribution of Punishments",0.022450423755713
"https://openalex.org/W2111595550",NA,"",NA,11,"Restoring Responsibility: Promoting Justice, Therapy and Reform Through Direct Brain Interventions",0.00169622418403333
"https://openalex.org/W1566367898",NA,"",NA,9,"Rights: Beyond Interest Theory and Will Theory?",0.0234785499336745
"https://openalex.org/W1589951838",NA,"",NA,9,"Equality of Resources and Procreative Justice",0.0154376750257492
"https://openalex.org/W3122273910",NA,"",NA,7,"Causing the Conditions of One's Own Defense: A Study in the Limits of Theory in Criminal Law Doctrine",0.0103097577743049
"https://openalex.org/W2085583742",NA,"",NA,5,"E Contrario Reasoning: The Dilemma of the Silent Legislator",0.0197563013532776
"https://openalex.org/W2146324225",NA,"",NA,9,"A Basic Classification of Legal Institutions",0.0164370135630574
"https://openalex.org/W603543320",NA,"",NA,5,"Parliamentary Sovereignty: Contemporary Debates",0.0276493226452899
"https://openalex.org/W2029341739",NA,"",NA,9,"REVIEW ESSAY, THE 2006 WORLD DEVELOPMENT REPORT: EQUITY AND DEVELOPMENT",0.00976119549276388
"https://openalex.org/W2150911060",NA,"",NA,2,"Individual Rights and the Democratic Boundary Problem",0.00751122452832201
"https://openalex.org/W1967124739",NA,"",NA,1,"The Moral Magic of Consent (II)",0.0060769974782213
"https://openalex.org/W1576620089",NA,"",NA,11,"Forgiveness and Retribution: Responding to Wrongdoing",0.00357194161790635
"https://openalex.org/W2075785073",NA,"",NA,2,"Human rights do not make global democracy",0.0120870961426694
"https://openalex.org/W2068001917",NA,"",NA,11,"Desert, fairness, and resentment",0.00759826444407641
"https://openalex.org/W2486502974",NA,"",NA,11,"Free Will Skepticism and Criminal Punishment",0.00496195220440138
"https://openalex.org/W2043196526",NA,"",NA,12,"Raz on Detachment, Acceptance and Describability",0.009006002608478
"https://openalex.org/W1986788852",NA,"",NA,0,"Computing Strong and Weak Permissions in Defeasible Logic",0.00729095972665073
"https://openalex.org/W1969622671",NA,"",NA,11,"Punishment and compensation: Victims, offenders and the state",0.00650297091819607
"https://openalex.org/W1565953347",NA,"",NA,7,"Law, science, and humanity: The normative foundation of social science in law.",0.0034131736970528
"https://openalex.org/W1994135215",NA,"",NA,9,"Fairness and Political Obligation",0.0197626920680513
"https://openalex.org/W2169256497",NA,"",NA,0,"A conceptual, case-relation representation of text for intelligent retrieval",0.0135474134540499
"https://openalex.org/W651469379",NA,"",NA,19,"The Philosophy of Tort Law",0.0107719833797843
"https://openalex.org/W2044255462",NA,"",NA,1,"On following orders in an unjust war",0.00728417693583714
"https://openalex.org/W2053588557",NA,"",NA,9,"POLITICAL OBLIGATION AND THE PARTICULARITY REQUIREMENT",0.0338010770539998
"https://openalex.org/W2052982726",NA,"",NA,11,"A Deterrence Theory of Punishment",0.0222157792747145
"https://openalex.org/W2139283279",NA,"",NA,11,"The emotional depravity of psychopaths and culpability",0.0020093065955551
"https://openalex.org/W2466618881",NA,"",NA,0,"Goal-based Reasoning for Argumentation",0.0064328408971235
"https://openalex.org/W2024874127",NA,"",NA,12,"The Decay of International Law: A Reappraisal of the Limits of Legal Imagination in International Affairs",0.0121249577269385
"https://openalex.org/W1547299604",NA,"",NA,9,"Luck egalitarians versus relational egalitarians: on the prospects of a pluralist account of egalitarian justice",0.0160504134775087
"https://openalex.org/W206984932",NA,"",NA,0,"Logic, Context and Valid Inference Or: Can there be a Logic of Law?",0.0256037336657463
"https://openalex.org/W1535654961",NA,"",NA,0,"Arguing by Analogy in Law: A Case-Based Model",0.0128852583766259
"https://openalex.org/W1500423845",NA,"",NA,11,"Human Rights in Criminal Proceedings",0.00111032431090391
"https://openalex.org/W1993066664",NA,"",NA,11,"Criminal Remedies: Restitution, Punishment, or Both?",0.0153673082304466
"https://openalex.org/W2000633529",NA,"",NA,11,"Criminal Justice and Legal Reparations as an Alternative to Punishment",0.0191197821505735
"https://openalex.org/W2039330167",NA,"",NA,11,"Censure theory and intuitions about punishment",0.0180575195174256
"https://openalex.org/W1587773505",NA,"",NA,11,"Appearances of the good : an essay on the nature of practical reason",0.0016264469651657
"https://openalex.org/W1974760718",NA,"",NA,12,"The Political Content of Legal Theory",0.0818399065494645
"https://openalex.org/W2039652618",NA,"",NA,2,"Political legitimacy, justice and consent",0.0151813114710075
"https://openalex.org/W3123624702",NA,"",NA,19,"Justifying Self-Defense",0.00545848166755657
"https://openalex.org/W2029698612",NA,"",NA,11,"The failure of retributivism",0.0151773522631322
"https://openalex.org/W2056844995",NA,"",NA,0,"How to make and defend a proposal in a deliberation dialogue",0.00714328908592758
"https://openalex.org/W3156629730",NA,"",NA,2,"Bad samaritanism and the causation of harm",0.00397172851589748
"https://openalex.org/W2141406227",NA,"",NA,12,"SHAPIRO ON LEGAL POSITIVISM AND JOINTLY INTENTIONAL ACTIVITY",0.00744405394144169
"https://openalex.org/W3175426386",NA,"",NA,11,"Harm and retribution",0.0138634932409824
"https://openalex.org/W1981042615",NA,"",NA,9,"Le libertarisme de gauche et la justice",0.036340233056323
"https://openalex.org/W3124697167",NA,"",NA,12,"The Methodology of Jurisprudence: Thirty Years Off the Point",0.0139166829216021
"https://openalex.org/W89757254",NA,"",NA,9,"Policy, Principle, and Incrementalism: Dworkin's Jurisprudence of Race",0.0117503772631017
"https://openalex.org/W2023205346",NA,"",NA,13,"Legal Ontologies in Knowledge Engineering and Information Management",0.0154804006075328
"https://openalex.org/W3123447486",NA,"",NA,6,"Political rights, republican freedom, and temporary workers",0.00794054902644279
"https://openalex.org/W2783220515",NA,"",NA,9,"Distributions and Relations: A Hybrid Account:",0.00857357189820257
"https://openalex.org/W2162640189",NA,"",NA,9,"Political Liberalism vs. “The Great Game of Politics”: The Politics of Political Liberalism",0.00238575578937912
"https://openalex.org/W1993674054",NA,"",NA,9,"Law and Obligation",0.0168917210957424
"https://openalex.org/W2014772536",NA,"",NA,12,"A POSITIVIST ROUTE FOR EXPLAINING HOW FACTS MAKE LAW",0.00970341580711573
"https://openalex.org/W2147572210",NA,"",NA,9,"Collective responsibility and the state",0.0160297237484497
"https://openalex.org/W2137686272",NA,"",NA,0,"Burdens and standards of proof for inference to the best explanation: three case studies",0.00497845930241069
"https://openalex.org/W1509713801",NA,"",NA,0,"Argument from Expert Opinion as Legal Evidence: Critical Questions and Admissibility Criteria of Expert Testimony in the American Legal System",0.00468259653169377
"https://openalex.org/W3125506016",NA,"",NA,0,"Similarity, precedent and argument from analogy",0.00808354634487756
"https://openalex.org/W2032626869",NA,"",NA,11,"Hooked on Hype: Addiction and Responsibility",0.00150630956293
"https://openalex.org/W2104867968",NA,"",NA,11,"Frankfurt's Argument against Alternative Possibilities: Looking Beyond the Examples†",0.00479335081522304
"https://openalex.org/W626087187",NA,"",NA,11,"Punishment and political theory",0.0236180701143044
"https://openalex.org/W2035717216",NA,"",NA,12,"On the Autonomy of Legal Reasoning",0.0431263489266963
"https://openalex.org/W2071406112",NA,"",NA,0,"Norm-system revision: theory and application",0.0118662296765895
"https://openalex.org/W2008958527",NA,"",NA,9,"Obligation and Joint Commitment",0.00398951641977222
"https://openalex.org/W2797431723",NA,"",NA,7,"Law as a Kantian Idea of Reason",0.0122967363025696
"https://openalex.org/W2000861207",NA,"",NA,9,"Two Models of Equality and Responsibility",0.00889371212409042
"https://openalex.org/W2026135738",NA,"",NA,11,"Retribution: Punishment's Formative Aim",0.0129059983745103
"https://openalex.org/W2082812513",NA,"",NA,0,"Law, learning and representation",0.00922581031335735
"https://openalex.org/W2083680054",NA,"",NA,19,"A THEORY OF NECESSITY",0.0117786191781018
"https://openalex.org/W2015882979",NA,"",NA,12,"Legal Positivism as an Idea About Morality",0.0214247635106647
"https://openalex.org/W628309364",NA,"",NA,11,"Ethics and criminal justice : an introduction",0.00664607697299873
"https://openalex.org/W1562492753",NA,"",NA,2,"Legitimate International Institutions: A Neorepublican Perspective",0.0199197046553982
"https://openalex.org/W2328389233",NA,"",NA,11,"Why Punish the Deserving",0.0279865279276269
"https://openalex.org/W1966077469",NA,"",NA,18,"Corporate responsibility and corporate personhood",0.00268859125275764
"https://openalex.org/W2165008051",NA,"",NA,18,"From Fictions and Aggregates to Real Entities in the Theory of the Firm",0.00298450096054488
"https://openalex.org/W2489332122",NA,"",NA,7,"The Social Origins of Property",0.0117723662363965
"https://openalex.org/W2006798587",NA,"",NA,12,"Truth and Objectivity in Law",0.0107376925577947
"https://openalex.org/W2018051592",NA,"",NA,11,"Shame, forgiveness, and juvenile justice",0.00420406490494556
"https://openalex.org/W2026719361",NA,"",NA,11,"A Research-Based Theory of Addictive Motivation",0.00169673499478932
"https://openalex.org/W2132397027",NA,"",NA,12,"Marmor on Meaning, Interpretation, and Legislative Intention",0.0135274759731891
"https://openalex.org/W3124103069",NA,"",NA,5,"Deliberative Democracy and Constitutional Review",0.0113570587972263
"https://openalex.org/W621932896",NA,"",NA,5,"Ordering Pluralism: A Conceptual Framework for Understanding the Transnational Legal World",0.00938156115788008
"https://openalex.org/W2117719727",NA,"",NA,0,"Challenges for a CBR framework for argumentation in open MAS",0.0053935093692978
"https://openalex.org/W2055912896",NA,"",NA,0,"A legal case OWL ontology with an instantiation of Popov v. Hayashi",0.00753992497029947
"https://openalex.org/W1271677168",NA,"",NA,2,"The guardian of the constitution : Hans Kelsen and Carl Schmitt on the limits of constitutional law",0.0106685068777143
"https://openalex.org/W2120734245",NA,"",NA,0,"Recent Advances in Computational Models of Natural Argument",0.0121989373210768
"https://openalex.org/W2493755710",NA,"",NA,13,"Approaches to Legal Ontologies",0.00276621615985785
"https://openalex.org/W2074366137",NA,"",NA,0,"Reason-Based Logic: a Logic for Reasoning with Rules and Reasons",0.0296400841618934
"https://openalex.org/W2152038736",NA,"",NA,0,"Argument schemes for reasoning about trust",0.00245918326372505
"https://openalex.org/W2250282136",NA,"",NA,7,"Legal Discourse across Cultures and Systems",0.00214933143871375
"https://openalex.org/W1577558720",NA,"",NA,8,"Patriarchal Religion, Sexuality, and Gender: A Critique of New Natural Law",0.00866930462183808
"https://openalex.org/W1992259715",NA,"",NA,0,"Reconstructing Popov v. Hayashi in a framework for argumentation with structured arguments and Dungean semantics",0.0240787443302129
"https://openalex.org/W1976066090",NA,"",NA,5,"Legal Pluralism as Evolutionary Achievement of Community Law",0.00251703565547013
"https://openalex.org/W2072355180",NA,"",NA,8,"Toward a Consistent Natural-Law Ethics of Killing",0.00876739319032987
"https://openalex.org/W1552009708",NA,"",NA,11,"From social justice to criminal justice : poverty and the administration of criminal law",0.011889752683107
"https://openalex.org/W1976700486",NA,"",NA,12,"Conceptualizing and Measuring Rule of Law Constructs, 1850–2010",0.00916961144634983
"https://openalex.org/W2615740944",NA,"",NA,17,"What is so special about online (as compared to offline) hate speech",0.00139794772127295
"https://openalex.org/W2267198438",NA,"",NA,11,"Harm to the unconceived",0.00451766397599188
"https://openalex.org/W2042170367",NA,"",NA,11,"When Is Birth Unfair to the Child",0.00240691052210428
"https://openalex.org/W3126016604",NA,"",NA,12,"An Argument Against the Social Fact Thesis (and Some Additional Preliminary Steps Towards a New Conception of Legal Positivism)",0.0131738001179204
"https://openalex.org/W2095183148",NA,"",NA,7,"Two Conceptions of Civil Rights",0.0377018055210246
"https://openalex.org/W635118925",NA,"",NA,19,"A Theory of Justification: Societal Harm as a Prerequisite for Criminal Liability",0.0196895002473133
"https://openalex.org/W2494199661",NA,"",NA,9,"Civic Republicanism and Civic Education",0.00582746731891967
"https://openalex.org/W1568640766",NA,"",NA,11,"A Unified Empirical Account of Responsibility Judgments",0.00542908460483224
"https://openalex.org/W2038736395",NA,"",NA,9,"In Defense of Hard Paternalism",0.00553964285009831
"https://openalex.org/W3123709009",NA,"",NA,2,"Who are Refugees",0.00205518989154661
"https://openalex.org/W1591817273",NA,"",NA,1,"Complicity, Cause and Blame: A Study in the Interpretation of Doctrine",0.00743138794704606
"https://openalex.org/W3124662247",NA,"",NA,11,"Towards a Modest Legal Moralism",0.00650292632941651
"https://openalex.org/W2594682492",NA,"",NA,0,"Proof with and without probabilities",0.00649722368613566
"https://openalex.org/W2143314283",NA,"",NA,0,"A formal model of adjudication dialogues",0.0504561042019912
"https://openalex.org/W2090724354",NA,"",NA,21,"Pursuing the Good-Indirectly",0.00583722093792879
"https://openalex.org/W3133258790",NA,"",NA,11,"A consensual theory of punishment",0.0160432139320291
"https://openalex.org/W1580879255",NA,"",NA,0,"The Toulmin Argument Model in Artificial Intelligence",0.00515903365932951
"https://openalex.org/W2134149556",NA,"",NA,13,"A method for the development of legal knowledge systems",0.00228994551557346
"https://openalex.org/W2001611392",NA,"",NA,11,"Punishment as language: Misleading analogy for desert theorists",0.0171605982886945
"https://openalex.org/W2003866698",NA,"",NA,11,"The justification of punishment and the justification of political authority",0.0138422232350151
"https://openalex.org/W2026338900",NA,"",NA,11,"Reciprocity as a justification for retributivism",0.014648945279393
"https://openalex.org/W2345486291",NA,"",NA,11,"Pereboom on Punishment: Funishment, Innocence, Motivation, and Other Difficulties",0.00627635221659368
"https://openalex.org/W2044200531",NA,"",NA,0,"An example of integrating legal case based reasoning with object-oriented rule-based systems: IKBALS II",0.0116208486788463
"https://openalex.org/W592741105",NA,"",NA,7,"Privacy, property and personality : civil law perspectives on commercial appropriation",0.00295754972074801
"https://openalex.org/W3159379715",NA,"",NA,12,"Is the Rule of Law an Essentially Contested Concept",0.00802458347470746
"https://openalex.org/W2057916492",NA,"",NA,19,"Two Liberal Fallacies in the Hate Crimes Debate",0.00269833760970226
"https://openalex.org/W1992247502",NA,"",NA,5,"Waldron on Law and Disagreement",0.0181638455588816
"https://openalex.org/W2014831623",NA,"",NA,0,"Deliberation dialogues for reasoning about safety critical actions",0.00336204192799161
"https://openalex.org/W2094535396",NA,"",NA,8,"Natural Law, God, Religion, and Human Fulfillment",0.00776429564142763
"https://openalex.org/W2118477550",NA,"",NA,0,"Introducing the Logic and Law Corner",0.0157704686624917
"https://openalex.org/W1981032217",NA,"",NA,2,"Giving Up the Goods: Rethinking the Human Right to Subsistence, Institutional Justice, and Imperfect Duties",0.00766034276344448
"https://openalex.org/W2045481428",NA,"",NA,6,"Facts and values in politics and Searle's Construction of Social Reality",0.0151733810736205
"https://openalex.org/W2161214005",NA,"",NA,7,"Property: A Bundle of Rights? Prologue to the Property Symposium",0.00306775051994469
"https://openalex.org/W2340535024",NA,"",NA,0,"A Classification System for Argumentation Schemes",0.00249025121225885
"https://openalex.org/W2170918625",NA,"",NA,2,"Resources versus Capabilities: Social Endowments in Egalitarian Theory",0.0197081830120959
"https://openalex.org/W2010523212",NA,"",NA,11,"On the Criminal Culpability of Successful and Unsuccessful Psychopaths",0.00207773172225679
"https://openalex.org/W2151114214",NA,"",NA,6,"Interactional international law: an introduction",0.00669901202230247
"https://openalex.org/W2029509807",NA,"",NA,19,"Torts of necessity: A moral theory of compensation",0.015861060093865
"https://openalex.org/W2087913450",NA,"",NA,19,"Self-Defense and Culpability",0.00377530799031371
"https://openalex.org/W2055089609",NA,"",NA,11,"Beyond proportionate punishment: Difficult cases and the 1991 Criminal Justice Act",0.00742628752835667
"https://openalex.org/W3124079230",NA,"",NA,11,"RETRIBUTIVISM AND TRUST",0.00751488646423248
"https://openalex.org/W2041101130",NA,"",NA,0,"Project report: Split-Up -- A Legal Expert System which determines property division upon divorce",0.00319586138034463
"https://openalex.org/W2550619487",NA,"",NA,0,"Formalizing value-guided argumentation for ethical systems design",0.0217147817432543
"https://openalex.org/W2064455637",NA,"",NA,9,"The Duty to Obey the Law",0.0171856025554488
"https://openalex.org/W2029873464",NA,"",NA,5,"Between Law and Social Norms: The Evolution of Global Governance",0.00352708506183102
"https://openalex.org/W1968014174",NA,"",NA,7,"WASHINGTON, DU BOIS AND PLESSY V. FERGUSON",0.0377018055210246
"https://openalex.org/W2092665693",NA,"",NA,7,"Introduction: The Sins of Segregation",0.0377018055210246
"https://openalex.org/W3125399593",NA,"",NA,0,"Formal models of coherence and legal epistemology",0.0227180987443561
"https://openalex.org/W2106966279",NA,"",NA,12,"The Judicial Community",0.00819252823927718
"https://openalex.org/W2810508172",NA,"",NA,2,"Is There a Distinctively Political Normativity",0.00401155817909758
"https://openalex.org/W77791265",NA,"",NA,1,"Human Rights Obligations of Business: A chasm between ‘is’ and ‘ought’? A critique of the normative foundations of the SRSG’s Framework and the Guiding Principles",0.00696976092608661
"https://openalex.org/W2171753860",NA,"",NA,0,"Intermediaries and intervenients in normative systems",0.0184841247680089
"https://openalex.org/W3122080544",NA,"",NA,19,"On the use and abuse of necessity in the Law of State responsibility",0.0138450928304285
"https://openalex.org/W2075066547",NA,"",NA,7,"When mistakes happen: Commonsense rules of culpability.",0.00512317760208863
"https://openalex.org/W2017740649",NA,"",NA,9,"Choices Chance and Change: Luck Egalitarianism Over Time",0.00780827098595473
"https://openalex.org/W2322978345",NA,"",NA,5,"Justices and Legal Clarity: Analyzing the Complexity of U.S. Supreme Court Opinions",0.000936453742894591
"https://openalex.org/W1983025967",NA,"",NA,19,"The Rights Forfeiture Theory of Punishment",0.0241462542347392
"https://openalex.org/W1979535273",NA,"",NA,0,"Logical tools for legal argument: a practical assessment in the domain of tort",0.0226970488097877
"https://openalex.org/W1508003592",NA,"",NA,13,"Introduction: Agents and Norms: How to fill the gap?",0.00101831535436303
"https://openalex.org/W1823658163",NA,"",NA,2,"Global political legitimacy beyond justice and democracy",0.0095506854604789
"https://openalex.org/W2092059399",NA,"",NA,19,"A Primer on the Distinction between Justification and Excuse",0.00230498402974523
"https://openalex.org/W2079849494",NA,"",NA,11,"Four Threats to the Presumption of Innocence",0.00179842734579774
"https://openalex.org/W69191592",NA,"",NA,0,"On the Issue of Contraposition of Defeasible Rules",0.00328790913954541
"https://openalex.org/W1518711685",NA,"",NA,7,"Intimate Relationships, Relational Contract Theory, and the Reach of Contract",0.00991918060855071
"https://openalex.org/W2022525851",NA,"",NA,9,"Construing Disagreement: Consensus and Invective in “Constitutional” Debate",0.0230836610206094
"https://openalex.org/W1968979711",NA,"",NA,0,"Putting interpretation in its place",0.0137714218135759
"https://openalex.org/W3121485947",NA,"",NA,12,"Is the rule of law really indifferent to human rights",0.0056929547790153
"https://openalex.org/W2432758157",NA,"",NA,11,"Accountability and Desert",0.00496446302173124
"https://openalex.org/W1927017635",NA,"",NA,0,"SHYSTER: A Pragmatic Legal Expert System",0.00541428146125603
"https://openalex.org/W2044376112",NA,"",NA,11,"Criminal desert and unfair advantage: What's the connection?",0.0180953154259194
"https://openalex.org/W625795696",NA,"",NA,0,"Burden of Proof, Presumption and Argumentation",0.00517311349965418
"https://openalex.org/W2017667358",NA,"",NA,0,"The Logic of Analogy in the Law",0.00212082374421518
"https://openalex.org/W2088719245",NA,"",NA,8,"The Basic Principles of Natural Law: A Reply to Ralph McInerny",0.00930063688169854
"https://openalex.org/W2290363421",NA,"",NA,1,"Authority and Responsibility in International Criminal Law",0.00694751607738621
"https://openalex.org/W2071984298",NA,"",NA,0,"Enhanced Dispute Resolution Through the Use of Information Technology",0.00193721986252247
"https://openalex.org/W2320236043",NA,"",NA,8,"Is Marriage Inherently Heterosexual",0.00740954915433289
"https://openalex.org/W1984502043",NA,"",NA,0,"The synergistic application of CBR to IR",0.00711492831296705
"https://openalex.org/W2136230668",NA,"",NA,0,"Informatics and the Foundations of Legal Reasoning",0.00746924654781974
"https://openalex.org/W2094015814",NA,"",NA,0,"Deduction and justification in the law : the role of legal terms and concepts",0.0100025132671674
"https://openalex.org/W1985723339",NA,"",NA,0,"Introduction to special issue on modelling Popov v. Hayashi",0.0439396301540152
"https://openalex.org/W2564659937",NA,"",NA,11,"Note on Defining 'Punishment'",0.0126092111245214
"https://openalex.org/W2088076854",NA,"",NA,0,"Argument schemes for reasoning with legal cases using values",0.028762597665097
"https://openalex.org/W3037404357",NA,"",NA,0,"Scalable and explainable legal prediction",0.00754912780969652
"https://openalex.org/W3124454284",NA,"",NA,3,"n Guilty Men",0.000393567534750539
"https://openalex.org/W3123270231",NA,"",NA,5,"The Rule of Law or the Rule of Politics? Harmonizing the Internal and External Views of Supreme Court Decision Making",0.00343078651077027
"https://openalex.org/W1520362016",NA,"",NA,15,"Criminal Sentencing and Intelligent Decision Support",0.00273250864630126
"https://openalex.org/W1993883625",NA,"",NA,0,"Analogical Reasoning in the Common Law",0.0131833845041954
"https://openalex.org/W1606901355",NA,"",NA,0,"Arno R. Lodder, DiaLaw: On Legal Justification and Dialogical Models of Argumentation. Law and Philosophy Library Vol. 42",0.0073933344656508
"https://openalex.org/W3125041361",NA,"",NA,8,"Between Morality and Efficacy: Reclaiming the Natural Law Theory of Lon Fuller",0.0365101531288134
