"id","centrality","Label","stat_inf_class","Modularity.Class","display_name","eigen"
"https://openalex.org/W1967948272",NA,"",19,6,"Recent Work on Free Will and Moral Responsibility",0.0141226304078288
"https://openalex.org/W1968224599",NA,"",20,7,"A Theory of Property",0.110330203129158
"https://openalex.org/W1968567610",NA,"",14,0,"A study of accrual of arguments, with applications to evidential reasoning",0.0737876613802592
"https://openalex.org/W1968969966",NA,"",20,23,"God, Locke, and Equality: Christian Foundations in Locke's Political Thought",0.0983587339467013
"https://openalex.org/W1969728099",NA,"",28,2,"Global Distributive Justice and the State",0.0316949840308026
"https://openalex.org/W1970817927",NA,"",2,7,"The evolution of common law",0.0525343685150492
"https://openalex.org/W1971233474",NA,"",5,11,"Punishment: the supposed justifications",0.0534708634916502
"https://openalex.org/W1972204416",NA,"",16,10,"The Vacuous Concept of Dignity",0.0112691953469082
"https://openalex.org/W1972337522",NA,"",14,0,"Legal reasoning with argumentation schemes",0.0663595714398607
"https://openalex.org/W1972471114",NA,"",16,2,"The Justification of Human Rights and the Basic Right to Justification. A Reflexive Approach",0.101005693978293
"https://openalex.org/W1972753218",NA,"",14,0,"Dialectic semantics for argumentation frameworks",0.0311905542433744
"https://openalex.org/W1973317916",NA,"",29,6,"Justification, coercion, and the place of public reason",0.0196008062768564
"https://openalex.org/W1973380483",NA,"",5,11,"Responsibility Without Blame: Empathy and the Effective Treatment of Personality Disorder.",0.0133832620393192
"https://openalex.org/W1973550469",NA,"",20,12,"An Introduction to International Institutional Law",0.0111851051958571
"https://openalex.org/W1973765901",NA,"",20,9,"The Science of a Legislator: The Natural Jurisprudence of David Hume and Adam Smith",0.0182482477528067
"https://openalex.org/W1974009048",NA,"",10,10,"Does Free Exercise of Religion Deserve Constitutional Mention",0.00455692511898443
"https://openalex.org/W1975154664",NA,"",5,11,"Giving desert its due",0.026129118740976
"https://openalex.org/W1975192395",NA,"",10,8,"In defense of natural law",0.0420235255374687
"https://openalex.org/W1975396405",NA,"",14,0,"Case-based reasoning and its implications for legal expert systems",0.0360126855753143
"https://openalex.org/W1975824152",NA,"",7,0,"The pragmatics of legal language",0.03278335101932
"https://openalex.org/W1976156251",NA,"",5,11,"BLAME, MORAL STANDING AND THE LEGITIMACY OF THE CRIMINAL TRIAL",0.0317773113904799
"https://openalex.org/W1976412163",NA,"",34,9,"The Conceptual Priority of Injustice",0.0106443599736998
"https://openalex.org/W1976416124",NA,"",22,6,"Building the Union: The Nature of Sovereignty in the Political Architecture of Europe",0.0154412133548375
"https://openalex.org/W1976898315",NA,"",31,5,"What is Legal Pluralism",0.153913820679776
"https://openalex.org/W1976902801",NA,"",14,0,"A factor-based definition of precedential constraint",0.0885090095344134
"https://openalex.org/W1977155386",NA,"",14,0,"Automatic detection of arguments in legal texts",0.0140291205582939
"https://openalex.org/W1977899774",NA,"",10,8,"The Closeness Problem and the Doctrine of Double Effect: A Way Forward",0.0365101531288134
"https://openalex.org/W1977927756",NA,"",5,11,"The Mad, the Bad, and the Psychopath",0.0113795363084644
"https://openalex.org/W1978533242",NA,"",10,23,"Some Critical Remarks about Samuel Pufendorf and His Contributions to Jurisprudence",0.00221567090565293
"https://openalex.org/W1979320841",NA,"",14,0,"The Zeno argumentation framework",0.110608133543657
"https://openalex.org/W1979394595",NA,"",14,0,"Properties and Complexity of Some Formal Inter-agent Dialogues",0.0246927868702046
"https://openalex.org/W1979424742",NA,"",33,12,"Structural adjudication and the new law merchant: A model of decentralized law",0.0376036886334129
"https://openalex.org/W1979872772",NA,"",10,8,"Constitutional Interpretation: Originalism",0.0365101531288134
"https://openalex.org/W1979887341",NA,"",11,9,"The moral foundation of rights",0.186831946236559
"https://openalex.org/W1980315820",NA,"",27,20,"Hart's Postscript and the Character of Political Philosophy",0.233561377894592
"https://openalex.org/W1980392060",NA,"",29,6,"Debate: Estlund on democratic authority",0.0305743829257182
"https://openalex.org/W1980691437",NA,"",31,2,"On the territorial rights of states",0.073817892038485
"https://openalex.org/W1981788994",NA,"",26,9,"The Realm of Rights",0.252277951370092
"https://openalex.org/W1982165862",NA,"",30,7,"The Language of the Law",0.0461206475365245
"https://openalex.org/W1982329760",NA,"",14,0,"Towards a formal account of reasoning about evidence: argumentation schemes and generalisations",0.0958840567429468
"https://openalex.org/W1982523722",NA,"",27,12,"The Concept of a Legal System: An Introduction to the Theory of Legal System",0.154407117808879
"https://openalex.org/W1982904830",NA,"",14,0,"Modelling reasoning about evidence in legal procedure",0.0520837696485053
"https://openalex.org/W1982966970",NA,"",20,12,"From Apology to Utopia: The Structure of International Legal Argument",0.129998553712866
"https://openalex.org/W1982993548",NA,"",14,0,"Persuasion and Value in Legal Argument",0.0594267159660011
"https://openalex.org/W1983189862",NA,"",34,2,"Assessing the global order: justice, legitimacy, or political justice?",0.0462967843141766
"https://openalex.org/W1984505550",NA,"",28,2,"The Right to Relocation: Disappearing Island Nations and Common Ownership of the Earth",0.017886671548085
"https://openalex.org/W1985489930",NA,"",5,7,"Judgments of causation, responsibility, and punishment in cases of harm-doing.",0.00604308710618886
"https://openalex.org/W1985565797",NA,"",5,11,"Mental Impairment, Moral Understanding and Criminal Responsibility: Psychopathy and the Purposes of Punishment",0.011456869701375
"https://openalex.org/W1985670447",NA,"",10,10,"The Priority of Persons Revisited",0.00455692511898443
"https://openalex.org/W1985968075",NA,"",9,12,"Negative and Positive Positivism",0.218837120563974
"https://openalex.org/W1985971407",NA,"",29,6,"THE THEORY OF CRITICAL LEGAL STUDIES",0.0296892513661577
"https://openalex.org/W1986160508",NA,"",0,9,"Justifying the State",0.0496340292609742
"https://openalex.org/W1986410150",NA,"",10,8,"Toward a Consistent Natural-Law Ethics of False Assertion",0.0365101531288134
"https://openalex.org/W1986667594",NA,"",11,9,"The Idea of Justice and the Problem of Argument",0.0992995898639789
"https://openalex.org/W1986778800",NA,"",32,9,"Equality and equal opportunity for welfare",0.248715499810592
"https://openalex.org/W1986914532",NA,"",5,11,"Holding others responsible",0.00868335289848808
"https://openalex.org/W1987468100",NA,"",2,12,"Human Interaction and the Law",0.0690928080672437
"https://openalex.org/W1987478741",NA,"",19,6,"Agonistic Critiques of Liberalism: Perfection and Emancipation",0.0105398330640825
"https://openalex.org/W1987712056",NA,"",21,9,"Conflicts of law and morality",0.0874099248095279
"https://openalex.org/W1988403039",NA,"",26,11,"Offense to Others",0.081087044723069
"https://openalex.org/W1988634903",NA,"",24,13,"Deontic logic in the representation of law: Towards a methodology",0.0464493307730524
"https://openalex.org/W1989063420",NA,"",32,9,"The obligation to work",0.036340233056323
"https://openalex.org/W1989873401",NA,"",21,9,"The principle of fairness and political obligation",0.157013804635183
"https://openalex.org/W1990328343",NA,"",25,12,"Coordination and Convention at the Foundations of Law",0.208616336672834
"https://openalex.org/W1990362375",NA,"",8,12,"Law as a Moral Idea",0.19842058538694
"https://openalex.org/W1990449529",NA,"",34,2,"Domination and Distributive Justice",0.0176984086324606
"https://openalex.org/W1990609403",NA,"",10,8,"THE GOOD MAN AND THE UPRIGHT CITIZEN IN ARISTOTLE'S ETHICS AND POLITICS",0.000202859347764593
"https://openalex.org/W1990779512",NA,"",8,12,"The law in quest of itself",0.115806546558029
"https://openalex.org/W1992765174",NA,"",2,7,"Equality, Responsibility, and the Law",0.0682447624991927
"https://openalex.org/W1994751412",NA,"",28,2,"Superseding Historic Injustice",0.162775311678974
"https://openalex.org/W1994907864",NA,"",9,12,"Legal Realism and Legal Positivism Reconsidered",0.0749789320289981
"https://openalex.org/W1995011919",NA,"",2,7,"Wrestling with Law: (Geographical) Specificity vs. (Legal) Abstraction.",0.00437584208596824
"https://openalex.org/W1995700735",NA,"",14,0,"BankXX: a program to generate argument through case-base search",0.0500997562422674
"https://openalex.org/W1995770214",NA,"",14,0,"Predicting outcomes of case based legal arguments",0.0919353494230922
"https://openalex.org/W1996659825",NA,"",19,9,"In defense of liberal public reason: are slavery and abortion hard cases?",0.0455986898115392
"https://openalex.org/W1996790102",NA,"",28,2,"Obligation, Loyalty, Exile:",0.0253782820322741
"https://openalex.org/W1997394816",NA,"",28,9,"Political Obligation and the Natural Duties of Justice",0.0570708891779527
"https://openalex.org/W1997477862",NA,"",5,1,"Why Punish War Crimes? Victor’s Justice and Expressive Justifications of Punishment",0.00886629908480774
"https://openalex.org/W1997926766",NA,"",30,12,"Playing by the Rules: A Philosophical Examination of Rule-Based Decision-Making in Law and in Life",0.299745933812989
"https://openalex.org/W1997973011",NA,"",14,0,"Toward an intelligent tutoring system for teaching law students to argue with cases",0.0292753213855724
"https://openalex.org/W1998687338",NA,"",10,8,"Effects of Defects-Action or Argument? Thoughts about Deryck Beyleveld and Roger Brownsword's Law as a Moral Judgment",0.0433425872877159
"https://openalex.org/W1999532401",NA,"",25,12,"Incorporationism, Conventionality, and the Practical Difference Thesis",0.160896918588834
"https://openalex.org/W1999712459",NA,"",34,2,"Utopia or dystopia? Towards a normative analysis of differentiated integration",0.0214087205108511
"https://openalex.org/W2000387210",NA,"",14,0,"Automated argument assistance for lawyers",0.0485049512018423
"https://openalex.org/W2001282989",NA,"",5,11,"Playing Fair with Punishment",0.0627255913378931
"https://openalex.org/W2001584130",NA,"",14,0,"On the relation between legal language and legal argument: assumptions, applicability and dynamic priorities",0.0300879436172694
"https://openalex.org/W2001907939",NA,"",29,6,"Political Liberalism, Ethos Justice, and Gender Equality",0.0167665769264055
"https://openalex.org/W2002087186",NA,"",31,11,"Criminal Deterrence Research at the Outset of the Twenty-First Century",0.0249525015743154
"https://openalex.org/W2002427041",NA,"",10,23,"Samuel Pufendorf: Obligation as the Basis of the State",0.00221567090565293
"https://openalex.org/W2002848380",NA,"",14,0,"Process and Policy: Resource-Bounded NonDemonstrative Reasoning",0.0857881131637366
"https://openalex.org/W2002970990",NA,"",29,6,"Feminism, religion, and shared reasons: A defense of exclusive public reason",0.0272697288581281
"https://openalex.org/W2003066662",NA,"",14,0,"Practical reasoning as presumptive argumentation using action based alternating transition systems",0.0788770869825889
"https://openalex.org/W2003578483",NA,"",27,11,"Dangers of Dystopias in Penal Theory",0.000571264792830205
"https://openalex.org/W2003805585",NA,"",14,0,"Rationales and argument moves",0.144483468134192
"https://openalex.org/W2004624139",NA,"",5,11,"The Justification of Punishment",0.0246801598521079
"https://openalex.org/W2005949547",NA,"",14,0,"A history of AI and Law in 50 papers: 25 years of the international conference on AI and Law",0.0365639015178161
"https://openalex.org/W2007935474",NA,"",0,9,"Legitimate Authority Without Political Obligation",0.05266408410911
"https://openalex.org/W2008085691",NA,"",31,12,"Feminism Unmodified: Discourses on Life and Law",0.123827484472919
"https://openalex.org/W2008168692",NA,"",5,11,"The Problem with Negligence",0.0109574997296849
"https://openalex.org/W2008606374",NA,"",28,2,"Does Distance Matter Morally to the Duty to Rescue",0.031159821470316
"https://openalex.org/W2008734828",NA,"",29,6,"What the Liberal State Should Tolerate Within Its Borders",0.025280261374299
"https://openalex.org/W2009043119",NA,"",10,8,"Aristotle's Idea of Political Fraternity",0.000202859347764592
"https://openalex.org/W2009122572",NA,"",33,0,"Interpreting Statutes: A Comparative Study",0.12158674751258
"https://openalex.org/W2009157601",NA,"",10,8,"Levinasian Ethics and Legal Obligation",0.0365101531288134
"https://openalex.org/W2009299421",NA,"",14,0,"Using background knowledge in case-based legal reasoning: a computational model and an intelligent learning environment",0.0549290630667519
"https://openalex.org/W2009741018",NA,"",33,0,"The Concept of Coherence and Its Significance for Discursive Rationality",0.0937134691158826
"https://openalex.org/W2009896285",NA,"",9,12,"Was Austin Right After All? On the Role of Sanctions in a Theory of Law",0.122517521480273
"https://openalex.org/W2010366788",NA,"",14,0,"A hybrid formal theory of arguments, stories and criminal evidence",0.0614734528595703
"https://openalex.org/W2010371189",NA,"",2,7,"Patterns of American jurisprudence",0.121041972189043
"https://openalex.org/W2010376637",NA,"",11,9,"Priorities: Equitable versus Legal Assignments of Book Debts",0.00167561578383557
"https://openalex.org/W2010738252",NA,"",10,8,"Lex Iniusta Non Est Lex: Laws on Trial in Aquinas' Court of Conscience",0.0402755346075885
"https://openalex.org/W2010849541",NA,"",23,12,"A Formal Theory of the Rule of Law",0.098563653949495
"https://openalex.org/W2011393428",NA,"",17,12,"Ethics and the rule of law",0.132039935328235
"https://openalex.org/W2011512658",NA,"",20,7,"Takings: Private Property and the Power of Eminent Domain",0.15182354651432
"https://openalex.org/W2011931335",NA,"",5,1,"Why Prosecute? Critics of Punishment for Mass Atrocity",0.0077651279311027
"https://openalex.org/W2012169540",NA,"",4,5,"A Right-Based Critique of Constitutional Rights",0.140446682393977
"https://openalex.org/W2013196653",NA,"",2,7,"The Role of Subjective Benefit in the Law of Unjust Enrichment",0.0568474030097791
"https://openalex.org/W2013396264",NA,"",35,5,"Beyond the Sovereign State",0.124541233721709
"https://openalex.org/W2013522791",NA,"",5,11,"A Theory of Blame",0.0109443417932206
"https://openalex.org/W2014901261",NA,"",14,0,"AI & Law, Logic and Argument Schemes",0.0271955808092458
"https://openalex.org/W2015036260",NA,"",14,0,"Evaluating arguments based on Toulmin's scheme",0.0208305801176288
"https://openalex.org/W2016060927",NA,"",29,6,"Two Types of Civic Friendship",0.00191689002059371
"https://openalex.org/W2016621178",NA,"",8,7,"Have concepts, will travel: analytical jurisprudence in a global context",0.00140567767739514
"https://openalex.org/W2016893172",NA,"",19,9,"Forms and Limits of Utilitarianism",0.0929084423570471
"https://openalex.org/W2016919642",NA,"",14,0,"Representing Popov v Hayashi with dimensions and factors",0.0662927387973796
"https://openalex.org/W2017063570",NA,"",14,0,"The IKBALS project: Multi-modal reasoning in legal knowledge based systems",0.0185039044903035
"https://openalex.org/W2017462880",NA,"",30,7,"Legal Discourse: Studies in Linguistics, Rhetoric and Legal Analysis",0.0342287575092578
"https://openalex.org/W2017742644",NA,"",5,11,"The Problem of Enhanced Control",0.0037575361035461
"https://openalex.org/W2018150336",NA,"",8,12,"Is the Rule of Law an Essentially Contested Concept (In Florida)",0.200769170800372
"https://openalex.org/W2018171748",NA,"",10,8,"Conscience, Religion and the State",0.0134262775807151
"https://openalex.org/W2019175520",NA,"",2,7,"The Nature of the Judicial Process",0.218263517857323
"https://openalex.org/W2019280314",NA,"",10,8,"The New Natural Law Theory: A Reply to Jean Porter",0.0365101531288134
"https://openalex.org/W2019563417",NA,"",5,11,"I OUGHT, THEREFORE I CAN",0.0164766690982989
"https://openalex.org/W2019709613",NA,"",16,10,"Dialogue with Dictators: Judicial Resistance in Argentina and Brazil",0.0108781070426793
"https://openalex.org/W2019812305",NA,"",34,9,"Taking up space on earth: Theorizing territorial rights, the justification of states and immigration from a global standpoint",0.0106443599736998
"https://openalex.org/W2019907875",NA,"",31,12,"Denationalization and the Very Idea of Democratic Constitutionalism: The Case of the European Community",0.0140866873734998
"https://openalex.org/W2020108900",NA,"",20,9,"Natural Law and Moral Philosophy: From Grotius to the Scottish Enlightenment",0.0308897610139329
"https://openalex.org/W2020523815",NA,"",18,17,"On Difference and Equality",0.0276210100766699
"https://openalex.org/W2020788275",NA,"",16,10,"Lon L. Fuller, Gustav Radbruch, and the “positivist” theses",0.025035759090625
"https://openalex.org/W2021373778",NA,"",22,2,"The principle of constituted identities and the obligation to include",0.0486517047200944
"https://openalex.org/W2021418227",NA,"",2,9,"Fair-Play Obligations",0.0161800374752019
"https://openalex.org/W2021683802",NA,"",35,5,"The Philosophy of Criminal Law: Extending the Debates",0.0293021600215973
"https://openalex.org/W2021695404",NA,"",10,12,"Objectivity and Truth: You'd Better Believe It",0.231131647563712
"https://openalex.org/W202193167",NA,"",33,7,"Law, fact, and narrative coherence",0.0397098290457632
"https://openalex.org/W2022257388",NA,"",14,0,"Hard cases: a procedural approach",0.140487941867382
"https://openalex.org/W2022656908",NA,"",34,2,"Competing for Liberty: The Republican Critique of Democracy",0.00842076064056893
"https://openalex.org/W2022829934",NA,"",5,11,"Skepticism and Sanction: The Benefits of Rejecting Moral Responsibility",0.00606997369314981
"https://openalex.org/W2022880160",NA,"",27,20,"Do Philosophy and Sociology Mix? A Non-Essentialist Socio-Legal Positivist Analysis of the Concept of Law",0.0767559298221316
"https://openalex.org/W2023175431",NA,"",2,5,"What's Law Got to Do with It? Judicial Behavioralists Test the ""Legal Model"" of Judicial Decision Making",0.0666690157269963
"https://openalex.org/W2023238833",NA,"",18,9,"Social Justice in the Liberal State",0.252388923503871
"https://openalex.org/W2023270709",NA,"",5,11,"Moral responsibility and ignorance",0.0187479730485043
"https://openalex.org/W2023796327",NA,"",10,8,"FINNIS ON THE AUTHORITY OF LAW AND THE COMMON GOOD",0.00646275711699152
"https://openalex.org/W2024065431",NA,"",5,11,"Experimental Philosophy and Free Will",0.00758267291280142
"https://openalex.org/W2024341531",NA,"",18,9,"Theories of Justice",0.170190826521111
"https://openalex.org/W2024541204",NA,"",23,12,"Rational Law, Economic Development and the Case of China",0.0451285661597899
"https://openalex.org/W2024594479",NA,"",25,12,"Law, Morality and Society",0.110454503171884
"https://openalex.org/W2025800669",NA,"",31,12,"Law's Community: Legal Theory in Sociological Perspective",0.0766549212863582
"https://openalex.org/W2026106485",NA,"",14,0,"A simple computational model for nonmonotonic and adversarial legal reasoning",0.0422985877324191
"https://openalex.org/W2026133433",NA,"",0,9,"The nature and value of rights",0.184924976932833
"https://openalex.org/W2026572335",NA,"",24,13,"The role of semantics in legal expert systems and legal reasoning",0.014289350603854
"https://openalex.org/W2026693267",NA,"",0,9,"Associative Allegiances and Political Obligations",0.0677347520999595
"https://openalex.org/W2027019383",NA,"",2,7,"Defending the Criminal Law: Reflections on the Changing Character of Crime, Procedure, and Sanctions",0.014415100023897
"https://openalex.org/W2027101843",NA,"",28,9,"Recognitional Legitimacy and the State System",0.0396257506941541
"https://openalex.org/W2028501282",NA,"",22,5,"Constitutional Democracy: A Paradoxical Union of Contradictory Principles?",0.150369259113324
"https://openalex.org/W2028502863",NA,"",34,2,"From Demos to Demoi: Democracy across Borders",0.038521838676731
"https://openalex.org/W2029881118",NA,"",31,6,"A Deliberative Approach to Conflicts of Culture",0.0250315723455718
"https://openalex.org/W2029888259",NA,"",33,12,"Of laws in general",0.259003482710216
"https://openalex.org/W2029896180",NA,"",11,9,"Doing and Deserving: Essays in the Theory of Responsibility",0.130377394735641
"https://openalex.org/W2029896775",NA,"",14,0,"To Catch a Thief With and Without Numbers: Arguments, Scenarios and Probabilities in Evidential Reasoning.",0.00498718037861234
"https://openalex.org/W2030444601",NA,"",5,11,"Persons, punishment, and free will skepticism",0.00863869796297967
"https://openalex.org/W2031586784",NA,"",23,12,"“Protestant” interpretation and social practices",0.03887585174785
"https://openalex.org/W2032472710",NA,"",6,2,"From Nuremburg to Kosovo: The Morality of Illegal International Legal Reform *",0.0221822910147933
"https://openalex.org/W2032902905",NA,"",0,9,"The Authority of Democracy",0.140930970113316
"https://openalex.org/W2032974234",NA,"",14,0,"Building explanations from rules and structured cases",0.0877745842439291
"https://openalex.org/W2032998746",NA,"",31,1,"Date rape: A feminist analysis",0.00255237668548352
"https://openalex.org/W2033133948",NA,"",22,6,"Enfranchising all affected interests, and its alternatives",0.163524816994689
"https://openalex.org/W2033787843",NA,"",14,0,"An implementation of Eisner v. Macomber",0.115221863318506
"https://openalex.org/W2034635248",NA,"",28,2,"How to Be a Free People",0.00726766212646928
"https://openalex.org/W2034885653",NA,"",14,0,"Argument-based applications to knowledge engineering",0.029852183800897
"https://openalex.org/W2034903527",NA,"",5,11,"The Varieties of Retributive Experience",0.0337679822514995
"https://openalex.org/W2034927516",NA,"",14,0,"Argumentation schemes and generalisations in reasoning about evidence",0.068465716072713
"https://openalex.org/W2035148892",NA,"",9,12,"LAW, MORALITY, AND THE GUIDANCE OF CONDUCT",0.0873784308332679
"https://openalex.org/W2035297989",NA,"",8,5,"China's Long March toward Rule of Law",0.0563903891915198
"https://openalex.org/W2035416838",NA,"",14,0,"Conditional entailment: bridging two approaches to default reasoning",0.0796776358737128
"https://openalex.org/W2035707119",NA,"",23,12,"The Idea Of An Overlapping Consensus",0.229836688191131
"https://openalex.org/W2035770827",NA,"",24,13,"Ontologies in legal information systems; the need for explicit specifications of domain conceptualisations",0.0260376907206385
"https://openalex.org/W2037262533",NA,"",14,0,"BankXX: Supporting legal arguments through heuristic retrieval",0.0751478964569354
"https://openalex.org/W2038328647",NA,"",32,7,"Relational Rights and Responsibilities: Revisioning the Family in Liberal Political Theory and Law",0.0377018055210246
"https://openalex.org/W2038608783",NA,"",0,9,"Restitution: A New Paradigm of Criminal Justice",0.0860216550894625
"https://openalex.org/W2038655856",NA,"",10,8,"The Aristotelian Spoudaios as Ethical Exemplar in Finnis’s Natural Law Theory",0.00646275711699152
"https://openalex.org/W2038703593",NA,"",26,12,"An introduction to the principles of morals and legislation",0.431658698682727
"https://openalex.org/W2039336033",NA,"",21,9,"Moral Free Riding",0.0242372441965158
"https://openalex.org/W2039760166",NA,"",5,11,"How to Make the Punishment Fit the Crime",0.058721879537865
"https://openalex.org/W2039980910",NA,"",6,9,"Rawls's Law of Peoples: Rules for a Vanished Westphalian World*",0.171197052738439
"https://openalex.org/W2040210902",NA,"",2,7,"A Theory of Negligence",0.0752472629780258
"https://openalex.org/W2040467548",NA,"",14,0,"Case law in extended argumentation frameworks",0.0304454934830788
"https://openalex.org/W2040506759",NA,"",2,5,"ON THE NATURE OF SUPREME COURT DECISION MAKING",0.0621563218992916
"https://openalex.org/W2040603703",NA,"",5,11,"Gauging Criminal Harm: A Living-Standard Analysis",0.0305341100970325
"https://openalex.org/W2041009095",NA,"",6,9,"The Idea of a Legitimate State",0.114407570216727
"https://openalex.org/W2041466501",NA,"",10,8,"HART ON MORAL RIGHTS AND LEGAL DUTIES",0.146709199675827
"https://openalex.org/W2041979514",NA,"",20,23,"Hobbes and the social contract tradition",0.155960607411636
"https://openalex.org/W2042181850",NA,"",24,21,"Leading a Life of its Own? The Roles of Reasonable Expectation in Contract Law",0.0177534591066515
"https://openalex.org/W2042702269",NA,"",14,0,"Factors, issues and values: revisiting reasoning with cases",0.0277104642276189
"https://openalex.org/W2042727912",NA,"",35,9,"LEGITIMACY, DEMOCRACY, AND RAZIAN AUTHORITY",0.0751492617595206
"https://openalex.org/W2043417657",NA,"",14,0,"Legal decision making as dialectical theory construction with argumentation schemes",0.0523985590297018
"https://openalex.org/W2043882007",NA,"",5,11,"Kant's Retributivism",0.0119681783217746
"https://openalex.org/W2044223990",NA,"",24,0,"Fundamental legal concepts: a formal and teleological characterisation",0.0558099692209264
"https://openalex.org/W2044818626",NA,"",5,11,"Responsibility for Attitudes: Activity and Passivity in Mental Life*",0.0264213290719417
"https://openalex.org/W2044908625",NA,"",5,11,"Responsibility and Control: A Theory of Moral Responsibility",0.169461534346779
"https://openalex.org/W2045151352",NA,"",5,11,"Hard Determinism and Punishment: A Practical Reductio",0.00461239114251462
"https://openalex.org/W2045182421",NA,"",14,0,"Theory based explanation of case law domains: 38",0.062526020086537
"https://openalex.org/W2045298523",NA,"",5,11,"How to Say Things with Walls",0.0281911686600874
"https://openalex.org/W2047661196",NA,"",0,9,"Toward a Liberal Theory of Political Obligation",0.0993897326035014
"https://openalex.org/W2048175845",NA,"",28,2,"On Benefiting from Injustice",0.022412773456671
